Search Engine,Link,Title,Source
Yahoo,https://www.benzinga.com/news/23/04/31763994/ubs-mulls-keeping-credit-suisse-private-wealth-unit-targeting-indias-wealthy-diaspora,UBS Mulls Keeping Credit Suisse Private Wealth Unit Targeting India's Wealthy Diaspora - UBS Gr...,Benzinga
Yahoo,https://in.investing.com/news/google-inc-receives-investment-bank-analyst-rating-update-3594613,UBS maintains Alphabet A at Buy,Investing.com
Yahoo,https://www.msn.com/en-us/money/companies/ubs-maintains-servicenow-now-buy-recommendation/ar-AA19SB7Y,UBS Maintains ServiceNow (NOW) Buy Recommendation,MSN News
Yahoo,https://footwearnews.com/2023/business/retail/ubs-50000-stores-could-close-by-2027-1203444605/,"50,000 Stores Could Close in the Next 5 Years, UBS Says",Footwear News
Yahoo,https://www.benzinga.com/content/www-tipranks-com/23/04/31786590/ubs-sticks-to-their-hold-rating-for-bayerische-motoren-werke-aktiengesellschaft-bamxf,UBS Sticks to Their Hold Rating for Bayerische Motoren Werke Aktiengesellschaft (BAMXF) - BMW...,Benzinga
Yahoo,https://www.etfdailynews.com/2023/04/17/ross-stores-inc-nasdaqrost-receives-average-rating-of-moderate-buy-from-brokerages/,"Ross Stores, Inc. (NASDAQ:ROST) Receives Average Rating of “Moderate Buy” from Brokerages",ETF DAILY NEWS
Yahoo,https://www.morningstar.com/news/dow-jones/202304146130/ubs-has-held-talks-to-bring-back-former-cfo-tom-naratil-bloomberg-reports,"UBS Has Held Talks to Bring Back Former CFO Tom Naratil, Bloomberg Reports",Morningstar
Yahoo,https://www.benzinga.com/content/www-tipranks-com/23/04/31786586/mercedes-benz-group-mbgaf-receives-a-buy-from-ubs,"Mercedes-Benz Group (MBGAF) Receives a Buy from UBS - Mercedes-Benz Group (OTC:MBGAF), Mercedes-Benz...",Benzinga
Yahoo,https://www.morningstar.com/news/marketwatch/20230413560/ges-stock-gains-after-ubs-boosts-price-target-by-15,GE's stock gains after UBS boosts price target by 15%,Morningstar
Yahoo,https://www.marketwatch.com/story/ges-stock-gains-after-ubs-boosts-price-target-by-15-c767a736,GE’s stock gains after UBS boosts price target by 15%,Market Watch
Yahoo,https://www.marketwatch.com/story/ges-stock-gains-after-ubs-boosts-price-target-by-15-c767a736,GE’s stock gains after UBS boosts price target by 15%,Market Watch
Yahoo,https://www.morningstar.com/news/marketwatch/20230414751/fed-approves-ubss-acquisition-of-us-subsidiaries-of-credit-suisse,Fed approves UBS's acquisition of U.S. subsidiaries of Credit Suisse,Morningstar
Yahoo,https://www.fxstreet.com/news/gold-price-forecast-xau-usds-rally-has-further-to-run-in-the-quarters-ahead-ubs-202304121456,Gold Price Forecast: XAU/USD’s rally has further to run in the quarters ahead – UBS,The Forex Market
Yahoo,https://finance.yahoo.com/news/fed-approves-ubs-credit-suisse-200000983.html?fr=sycsrp_catchall,Fed approves UBS-Credit Suisse deal in US,Reuters via Yahoo Finance
Yahoo,https://www.etfdailynews.com/2023/04/17/national-bank-of-canada-fi-sells-12227-shares-of-usana-health-sciences-inc-nyseusna/,"National Bank of Canada FI Sells 12,227 Shares of USANA Health Sciences, Inc. (NYSE:USNA)",ETF DAILY NEWS
Yahoo,https://www.barrons.com/articles/top-100-private-wealth-management-teams-ubs-5e448b0e,How This UBS Megateam Is Building Portfolios Now,Barron s Online
Yahoo,https://www.etfdailynews.com/2023/04/17/national-bank-of-canada-fi-buys-new-position-in-seneca-foods-co-nasdaqsenea/,National Bank of Canada FI Buys New Position in Seneca Foods Co. (NASDAQ:SENEA),ETF DAILY NEWS
Yahoo,https://www.marketwatch.com/story/swiss-lawmakers-open-session-looking-at-ubs-credit-suisse-deal-63d064b9,Swiss lawmakers open session looking at UBS-Credit Suisse deal,Market Watch
Yahoo,https://www.msn.com/en-us/money/markets/ubs-upgrades-ingredion-ingr/ar-AA19RjxQ?ocid=FinanceShimLayer,UBS Upgrades Ingredion (INGR),MSN News
Yahoo,https://www.msn.com/en-us/money/topstocks/ubs-maintains-molson-coors-beverage-tap-neutral-recommendation/ar-AA19yLMO?ocid=FinanceShimLayer,UBS Maintains Molson Coors Beverage (TAP) Neutral Recommendation,MSN News
Yahoo,https://www.etfdailynews.com/2023/04/12/ubs-group-begins-coverage-on-capital-southwest-nasdaqcswc/,UBS Group Begins Coverage on Capital Southwest (NASDAQ:CSWC),ETF DAILY NEWS
Yahoo,https://www.etfdailynews.com/2023/04/17/arch-capital-group-ltd-to-post-q1-2023-earnings-of-1-60-per-share-jefferies-financial-group-forecasts-nasdaqacgl/,"Arch Capital Group Ltd. to Post Q1 2023 Earnings of $1.60 Per Share, Jefferies Financial Group...",ETF DAILY NEWS
Yahoo,https://www.etfdailynews.com/2023/04/17/analysts-issue-forecasts-for-akoya-biosciences-inc-s-fy2023-earnings-nasdaqakya/,"Analysts Issue Forecasts for Akoya Biosciences, Inc.’s FY2023 Earnings (NASDAQ:AKYA)",ETF DAILY NEWS
Yahoo,https://www.benzinga.com/content/www-tipranks-com/23/04/31795649/ubs-sticks-to-their-buy-rating-for-deutsche-bank-ag-db,UBS Sticks to Their Buy Rating for Deutsche Bank AG (DB) - Deutsche Bank (NYSE:DB),Benzinga
Yahoo,https://www.etfdailynews.com/2023/04/17/allspring-global-investments-holdings-llc-invests-743000-in-tortoise-midstream-energy-fund-inc-nysentg/,"Allspring Global Investments Holdings LLC Invests $743,000 in Tortoise Midstream Energy Fund, Inc....",ETF DAILY NEWS
Yahoo,https://www.benzinga.com/content/www-tipranks-com/23/04/31736331/analysts-offer-insights-on-financial-companies-ubs-group-ag-ubs-and-corebridge-financial,"Analysts Offer Insights on Financial Companies: UBS Group AG (UBS) and Corebridge Financial, Inc....",Benzinga
Yahoo,https://www.msn.com/en-us/money/companies/barclays-follows-citi-goldman-and-morgan-stanley-in-cutting-100-investment-bank-jobs-despite-rate-hike-profits/ar-AA19X2KK?ocid=FinanceShimLayer,"Barclays follows Citi, Goldman and Morgan Stanley in cutting 100 investment bank jobs despite rate...",MSN News
Yahoo,https://www.etfdailynews.com/2023/04/15/jd-com-nasdaqjd-downgraded-to-neutral-at-ubs-group/,JD.com (NASDAQ:JD) Downgraded to “Neutral” at UBS Group,ETF DAILY NEWS
Yahoo,https://www.etfdailynews.com/2023/04/17/constellation-brands-inc-nysestz-receives-average-rating-of-moderate-buy-from-analysts/,"Constellation Brands, Inc. (NYSE:STZ) Receives Average Rating of “Moderate Buy” from Analysts",ETF DAILY NEWS
Yahoo,https://www.etfdailynews.com/2023/04/17/national-bank-of-canada-fi-reduces-stock-position-in-sprott-junior-gold-miners-etf-nysearcasgdj/,National Bank of Canada FI Reduces Stock Position in Sprott Junior Gold Miners ETF (NYSEARCA:SGDJ),ETF DAILY NEWS
Yahoo,https://www.etfdailynews.com/2023/04/17/national-bank-of-canada-fi-reduces-stock-position-in-sprott-junior-gold-miners-etf-nysearcasgdj/,National Bank of Canada FI Reduces Stock Position in Sprott Junior Gold Miners ETF (NYSEARCA:SGDJ),ETF DAILY NEWS
Yahoo,https://www.etfdailynews.com/2023/04/15/ingredion-nyseingr-upgraded-to-buy-at-ubs-group/,Ingredion (NYSE:INGR) Upgraded to “Buy” at UBS Group,ETF DAILY NEWS
Yahoo,https://www.etfdailynews.com/2023/04/12/western-union-nysewu-stock-rating-upgraded-by-ubs-group/,Western Union (NYSE:WU) Stock Rating Upgraded by UBS Group,ETF DAILY NEWS
Yahoo,https://www.etfdailynews.com/2023/04/17/short-interest-in-united-security-bancshares-nasdaqubfo-grows-by-24-2/,Short Interest in United Security Bancshares (NASDAQ:UBFO) Grows By 24.2%,ETF DAILY NEWS
Yahoo,https://www.etfdailynews.com/2023/04/17/932-shares-in-illinois-tool-works-inc-nyseitw-bought-by-james-hambro-partners/,932 Shares in Illinois Tool Works Inc. (NYSE:ITW) Bought by James Hambro & Partners,ETF DAILY NEWS
Yahoo,https://www.etfdailynews.com/2023/04/17/hsbc-holdings-plc-lonhsba-receives-average-rating-of-moderate-buy-from-analysts/,HSBC Holdings plc (LON:HSBA) Receives Average Rating of “Moderate Buy” from Analysts,ETF DAILY NEWS
Yahoo,https://www.etfdailynews.com/2023/04/12/smurfit-kappa-group-otcmktssmfky-upgraded-to-buy-at-ubs-group/,Smurfit Kappa Group (OTCMKTS:SMFKY) Upgraded to “Buy” at UBS Group,ETF DAILY NEWS
Yahoo,https://www.etfdailynews.com/2023/04/17/amazon-com-inc-nasdaqamzn-holdings-trimmed-by-barton-investment-management/,"Amazon.com, Inc. (NASDAQ:AMZN) Holdings Trimmed by Barton Investment Management",ETF DAILY NEWS
Yahoo,https://www.barrons.com/articles/the-dollars-era-of-outperformance-is-ending-how-to-step-away-fffae76d,"4 Ways to Reduce Dollar Exposure, According to UBS",Barron s Online
Yahoo,https://www.etfdailynews.com/2023/04/17/stocknews-com-begins-coverage-on-core-laboratories-nyseclb-2/,StockNews.com Begins Coverage on Core Laboratories (NYSE:CLB),ETF DAILY NEWS
Yahoo,https://finance.yahoo.com/news/fed-approves-ubs-credit-suisse-200000983.html?fr=sycsrp_catchall,Fed approves UBS-Credit Suisse deal in US,Reuters via Yahoo Finance
Yahoo,https://www.barrons.com/articles/top-100-private-wealth-management-teams-ubs-5e448b0e,How This UBS Megateam Is Building Portfolios Now,Barron s Online
Yahoo,https://www.etfdailynews.com/2023/04/17/national-bank-of-canada-fi-buys-new-position-in-seneca-foods-co-nasdaqsenea/,National Bank of Canada FI Buys New Position in Seneca Foods Co. (NASDAQ:SENEA),ETF DAILY NEWS
Yahoo,https://www.barrons.com/articles/mid-cap-banks-profits-deposits-funding-crisis-5aae9532,"Mid-Cap Banks Face New Pressure on Profits, UBS Warns",Barron s Online
Yahoo,https://www.msn.com/en-us/money/markets/ubs-upgrades-ingredion-ingr/ar-AA19RjxQ?ocid=FinanceShimLayer,UBS Upgrades Ingredion (INGR),MSN News
Yahoo,https://www.msn.com/en-us/money/topstocks/ubs-maintains-molson-coors-beverage-tap-neutral-recommendation/ar-AA19yLMO?ocid=FinanceShimLayer,UBS Maintains Molson Coors Beverage (TAP) Neutral Recommendation,MSN News
Yahoo,https://www.etfdailynews.com/2023/04/12/ubs-group-begins-coverage-on-capital-southwest-nasdaqcswc/,UBS Group Begins Coverage on Capital Southwest (NASDAQ:CSWC),ETF DAILY NEWS
Yahoo,https://www.etfdailynews.com/2023/04/17/arch-capital-group-ltd-to-post-q1-2023-earnings-of-1-60-per-share-jefferies-financial-group-forecasts-nasdaqacgl/,"Arch Capital Group Ltd. to Post Q1 2023 Earnings of $1.60 Per Share, Jefferies Financial Group...",ETF DAILY NEWS
Yahoo,https://www.etfdailynews.com/2023/04/17/analysts-issue-forecasts-for-akoya-biosciences-inc-s-fy2023-earnings-nasdaqakya/,"Analysts Issue Forecasts for Akoya Biosciences, Inc.’s FY2023 Earnings (NASDAQ:AKYA)",ETF DAILY NEWS
Yahoo,https://www.benzinga.com/content/www-tipranks-com/23/04/31795649/ubs-sticks-to-their-buy-rating-for-deutsche-bank-ag-db,UBS Sticks to Their Buy Rating for Deutsche Bank AG (DB) - Deutsche Bank (NYSE:DB),Benzinga
Yahoo,https://www.benzinga.com/content/seekingalpha-com/23/04/31814551/fed-approves-ubs-acquisition-of-credit-suisses-u-s-business,"Fed approves UBS' acquisition of Credit Suisse's U.S. business - Credit Suisse Group (NYSE:CS), UBS...",Benzinga
Yahoo,https://www.benzinga.com/content/www-tipranks-com/23/04/31736331/analysts-offer-insights-on-financial-companies-ubs-group-ag-ubs-and-corebridge-financial,"Analysts Offer Insights on Financial Companies: UBS Group AG (UBS) and Corebridge Financial, Inc....",Benzinga
Yahoo,https://www.msn.com/en-us/money/companies/barclays-follows-citi-goldman-and-morgan-stanley-in-cutting-100-investment-bank-jobs-despite-rate-hike-profits/ar-AA19X2KK?ocid=FinanceShimLayer,"Barclays follows Citi, Goldman and Morgan Stanley in cutting 100 investment bank jobs despite rate...",MSN News
Yahoo,https://www.etfdailynews.com/2023/04/17/constellation-brands-inc-nysestz-receives-average-rating-of-moderate-buy-from-analysts/,"Constellation Brands, Inc. (NYSE:STZ) Receives Average Rating of “Moderate Buy” from Analysts",ETF DAILY NEWS
Yahoo,https://www.etfdailynews.com/2023/04/15/jd-com-nasdaqjd-downgraded-to-neutral-at-ubs-group/,JD.com (NASDAQ:JD) Downgraded to “Neutral” at UBS Group,ETF DAILY NEWS
Yahoo,https://www.etfdailynews.com/2023/04/15/ingredion-nyseingr-upgraded-to-buy-at-ubs-group/,Ingredion (NYSE:INGR) Upgraded to “Buy” at UBS Group,ETF DAILY NEWS
Yahoo,https://www.etfdailynews.com/2023/04/12/western-union-nysewu-stock-rating-upgraded-by-ubs-group/,Western Union (NYSE:WU) Stock Rating Upgraded by UBS Group,ETF DAILY NEWS
Yahoo,https://www.etfdailynews.com/2023/04/17/national-bank-of-canada-fi-reduces-stock-position-in-sprott-junior-gold-miners-etf-nysearcasgdj/,National Bank of Canada FI Reduces Stock Position in Sprott Junior Gold Miners ETF (NYSEARCA:SGDJ),ETF DAILY NEWS
Yahoo,https://www.etfdailynews.com/2023/04/17/short-interest-in-united-security-bancshares-nasdaqubfo-grows-by-24-2/,Short Interest in United Security Bancshares (NASDAQ:UBFO) Grows By 24.2%,ETF DAILY NEWS
Yahoo,https://www.etfdailynews.com/2023/04/17/932-shares-in-illinois-tool-works-inc-nyseitw-bought-by-james-hambro-partners/,932 Shares in Illinois Tool Works Inc. (NYSE:ITW) Bought by James Hambro & Partners,ETF DAILY NEWS
Yahoo,https://www.barrons.com/articles/the-dollars-era-of-outperformance-is-ending-how-to-step-away-fffae76d,"4 Ways to Reduce Dollar Exposure, According to UBS",Barron s Online
Yahoo,https://www.etfdailynews.com/2023/04/17/hsbc-holdings-plc-lonhsba-receives-average-rating-of-moderate-buy-from-analysts/,HSBC Holdings plc (LON:HSBA) Receives Average Rating of “Moderate Buy” from Analysts,ETF DAILY NEWS
Yahoo,https://www.etfdailynews.com/2023/04/12/smurfit-kappa-group-otcmktssmfky-upgraded-to-buy-at-ubs-group/,Smurfit Kappa Group (OTCMKTS:SMFKY) Upgraded to “Buy” at UBS Group,ETF DAILY NEWS
Yahoo,https://www.etfdailynews.com/2023/04/17/amazon-com-inc-nasdaqamzn-holdings-trimmed-by-barton-investment-management/,"Amazon.com, Inc. (NASDAQ:AMZN) Holdings Trimmed by Barton Investment Management",ETF DAILY NEWS
Yahoo,https://www.benzinga.com/news/23/04/31788048/ubs-upgrades-ingredion-to-buy-raises-price-target-to-121,"UBS Upgrades Ingredion to Buy, Raises Price Target to $121 - Ingredion (NYSE:INGR)",Benzinga
Yahoo,https://www.etfdailynews.com/2023/04/17/stocknews-com-begins-coverage-on-core-laboratories-nyseclb-2/,StockNews.com Begins Coverage on Core Laboratories (NYSE:CLB),ETF DAILY NEWS
Yahoo,https://www.etfdailynews.com/2023/04/17/microsoft-co-nasdaqmsft-shares-sold-by-merrion-investment-management-co-llc/,Microsoft Co. (NASDAQ:MSFT) Shares Sold by Merrion Investment Management Co LLC,ETF DAILY NEWS
Yahoo,https://www.etfdailynews.com/2023/04/17/ameriprise-financial-inc-nyseamp-to-post-q1-2023-earnings-of-7-20-per-share-jefferies-financial-group-forecasts/,"Ameriprise Financial, Inc. (NYSE:AMP) to Post Q1 2023 Earnings of $7.20 Per Share, Jefferies...",ETF DAILY NEWS
Yahoo,https://www.etfdailynews.com/2023/04/17/ziegler-capital-management-llc-has-73-03-million-stock-position-in-microsoft-co-nasdaqmsft/,Ziegler Capital Management LLC Has $73.03 Million Stock Position in Microsoft Co. (NASDAQ:MSFT),ETF DAILY NEWS
Yahoo,https://www.etfdailynews.com/2023/04/15/montauk-renewables-nasdaqmntk-rating-increased-to-neutral-at-ubs-group/,Montauk Renewables (NASDAQ:MNTK) Rating Increased to Neutral at UBS Group,ETF DAILY NEWS
Yahoo,https://www.etfdailynews.com/2023/04/17/ziegler-capital-management-llc-has-73-03-million-stock-position-in-microsoft-co-nasdaqmsft/,Ziegler Capital Management LLC Has $73.03 Million Stock Position in Microsoft Co. (NASDAQ:MSFT),ETF DAILY NEWS
Yahoo,https://www.etfdailynews.com/2023/04/15/montauk-renewables-nasdaqmntk-rating-increased-to-neutral-at-ubs-group/,Montauk Renewables (NASDAQ:MNTK) Rating Increased to Neutral at UBS Group,ETF DAILY NEWS
Yahoo,https://www.etfdailynews.com/2023/04/17/factset-research-systems-inc-nysefds-shares-sold-by-allspring-global-investments-holdings-llc/,FactSet Research Systems Inc. (NYSE:FDS) Shares Sold by Allspring Global Investments Holdings LLC,ETF DAILY NEWS
Yahoo,https://www.etfdailynews.com/2023/04/17/exchange-traded-concepts-llc-buys-133202-shares-of-alphabet-inc-nasdaqgoogl/,"Exchange Traded Concepts LLC Buys 133,202 Shares of Alphabet Inc. (NASDAQ:GOOGL)",ETF DAILY NEWS
Yahoo,https://news.yahoo.com/bruce-springsteen-day-officially-recognized-003300600.html?fr=sycsrp_catchall,‘Bruce Springsteen Day’ to be officially recognized in New Jersey,NY Daily News via Yahoo News
Yahoo,https://www.etfdailynews.com/2023/04/17/allspring-global-investments-holdings-llc-raises-stake-in-diageo-plc-nysedeo/,Allspring Global Investments Holdings LLC Raises Stake in Diageo plc (NYSE:DEO),ETF DAILY NEWS
Yahoo,https://www.etfdailynews.com/2023/04/17/tronox-holdings-plc-nysetrox-shares-sold-by-allspring-global-investments-holdings-llc/,Tronox Holdings plc (NYSE:TROX) Shares Sold by Allspring Global Investments Holdings LLC,ETF DAILY NEWS
Yahoo,https://www.etfdailynews.com/2023/04/17/allspring-global-investments-holdings-llc-sells-8214-shares-of-comerica-incorporated-nysecma/,"Allspring Global Investments Holdings LLC Sells 8,214 Shares of Comerica Incorporated (NYSE:CMA)",ETF DAILY NEWS
Yahoo,https://uk.investing.com/news/economy/bank-of-england-considering-urgent-reform-of-deposit-guarantee-scheme--ft-2985677,Bank of England considering urgent reform of deposit guarantee scheme - FT By Reuters,Investing.com
Yahoo,https://www.msn.com/en-us/money/savingandinvesting/ubs-maintains-kimberly-clark-kmb-neutral-recommendation/ar-AA19yQD4?ocid=FinanceShimLayer,UBS Maintains Kimberly-Clark (KMB) Neutral Recommendation,MSN News
Yahoo,https://www.etfdailynews.com/2023/04/17/straumann-holding-ag-otcmktssauhy-given-average-recommendation-of-hold-by-brokerages/,Straumann Holding AG (OTCMKTS:SAUHY) Given Average Recommendation of “Hold” by Brokerages,ETF DAILY NEWS
Yahoo,https://www.thewestonforum.com/only-ubs-cs-puk-can-bring-light-into-the-darkness/,Only UBS/CS-PUK can bring light into the darkness,Weston Forum
Yahoo,https://www.etfdailynews.com/2023/04/17/sse-plc-lonsse-given-consensus-recommendation-of-moderate-buy-by-brokerages/,SSE plc (LON:SSE) Given Consensus Recommendation of “Moderate Buy” by Brokerages,ETF DAILY NEWS
Yahoo,https://www.msn.com/en-in/money/news/tcs-ceo-designate-sees-impact-on-some-projects-due-to-credit-suisse-ubs-merger/ar-AA19NCeF?ocid=FinanceShimLayer,TCS CEO designate sees impact on some projects due to Credit Suisse-UBS merger,MSN News
Yahoo,https://www.etfdailynews.com/2023/04/12/spirax-sarco-engineering-otcmktsspxsf-downgraded-by-ubs-group-to-neutral/,Spirax-Sarco Engineering (OTCMKTS:SPXSF) Downgraded by UBS Group to Neutral,ETF DAILY NEWS
Yahoo,https://www.benzinga.com/news/23/04/31762946/ubs-upgrades-goldman-sachs-gr-to-buy,UBS Upgrades Goldman Sachs Gr to Buy - Goldman Sachs Gr (NYSE:GS),Benzinga
Yahoo,https://www.benzinga.com/content/www-tipranks-com/23/04/31803500/hermes-international-hesaf-receives-a-buy-from-ubs,"Hermes International (HESAF) Receives a Buy from UBS - Hermes International (OTC:HESAY), Hermes...",Benzinga
Yahoo,https://www.etfdailynews.com/2023/04/17/zynerba-pharmaceuticals-zyne-investment-analysts-weekly-ratings-changes/,Zynerba Pharmaceuticals (ZYNE) – Investment Analysts’ Weekly Ratings Changes,ETF DAILY NEWS
Yahoo,https://www.etfdailynews.com/2023/04/17/national-bank-of-canada-fi-lowers-position-in-graphic-packaging-holding-nysegpk/,National Bank of Canada FI Lowers Position in Graphic Packaging Holding (NYSE:GPK),ETF DAILY NEWS
Yahoo,https://www.etfdailynews.com/2023/04/17/james-hambro-partners-buys-39913-shares-of-texas-instruments-incorporated-nasdaqtxn/,"James Hambro & Partners Buys 39,913 Shares of Texas Instruments Incorporated (NASDAQ:TXN)",ETF DAILY NEWS
Yahoo,https://www.msn.com/en-us/money/savingandinvesting/ubs-initiates-coverage-of-capital-southwest-cswc-with-neutral-recommendation/ar-AA19JSQD?ocid=FinanceShimLayer,UBS Initiates Coverage of Capital Southwest (CSWC) with Neutral Recommendation,MSN News
Yahoo,https://www.msn.com/en-us/money/topstocks/ubs-maintains-procter-gamble-pg-buy-recommendation/ar-AA19yOxj?ocid=FinanceShimLayer,UBS Maintains Procter & Gamble (PG) Buy Recommendation,MSN News
Yahoo,https://www.etfdailynews.com/2023/04/12/ubs-group-upgrades-asr-nederland-otcmktsasrrf-to-buy/,UBS Group Upgrades ASR Nederland (OTCMKTS:ASRRF) to Buy,ETF DAILY NEWS
Yahoo,https://www.msn.com/en-us/money/topstocks/ubs-maintains-oneok-oke-neutral-recommendation/ar-AA19yH9J?ocid=FinanceShimLayer,UBS Maintains ONEOK (OKE) Neutral Recommendation,MSN News
Yahoo,https://www.etfdailynews.com/2023/04/17/national-bank-of-canada-fi-increases-stake-in-inmode-ltd-nasdaqinmd/,National Bank of Canada FI Increases Stake in InMode Ltd. (NASDAQ:INMD),ETF DAILY NEWS
Yahoo,https://www.etfdailynews.com/2023/04/17/strs-ohio-has-761000-stock-holdings-in-powerschool-holdings-inc-nysepwsc/,"Strs Ohio Has $761,000 Stock Holdings in PowerSchool Holdings, Inc. (NYSE:PWSC)",ETF DAILY NEWS
Yahoo,https://www.etfdailynews.com/2023/04/17/exagen-inc-nasdaqxgn-short-interest-down-16-5-in-march/,Exagen Inc. (NASDAQ:XGN) Short Interest Down 16.5% in March,ETF DAILY NEWS
Yahoo,https://www.msn.com/en-us/money/savingandinvesting/ubs-upgrades-evercore-partners-evr/ar-AA19Mx8X?ocid=FinanceShimLayer,UBS Upgrades Evercore Partners (EVR),MSN News
Yahoo,https://www.msn.com/en-us/money/topstocks/ubs-maintains-pepsico-pep-buy-recommendation/ar-AA19yQMb?ocid=FinanceShimLayer,UBS Maintains PepsiCo (PEP) Buy Recommendation,MSN News
Yahoo,https://www.etfdailynews.com/2023/04/17/upwork-inc-nasdaqupwk-given-average-recommendation-of-moderate-buy-by-analysts/,Upwork Inc. (NASDAQ:UPWK) Given Average Recommendation of “Moderate Buy” by Analysts,ETF DAILY NEWS
Yahoo,https://www.etfdailynews.com/2023/04/17/leslies-inc-nasdaqlesl-given-average-recommendation-of-hold-by-brokerages/,"Leslie’s, Inc. (NASDAQ:LESL) Given Average Recommendation of “Hold” by Brokerages",ETF DAILY NEWS
Yahoo,https://www.etfdailynews.com/2023/04/17/ligand-pharmaceuticals-incorporated-nasdaqlgnd-forecasted-to-post-q3-2024-earnings-of-0-33-per-share/,Ligand Pharmaceuticals Incorporated (NASDAQ:LGND) Forecasted to Post Q3 2024 Earnings of $0.33 Per...,ETF DAILY NEWS
Yahoo,https://www.benzinga.com/news/23/04/31727023/ubs-downgrades-m-t-bank-to-neutral,UBS Downgrades M&T Bank to Neutral - M&T Bank (NYSE:MTB),Benzinga
Yahoo,https://www.etfdailynews.com/2023/04/11/regions-financial-nyserf-upgraded-by-ubs-group-to-buy/,Regions Financial (NYSE:RF) Upgraded by UBS Group to Buy,ETF DAILY NEWS
Yahoo,https://www.etfdailynews.com/2023/04/17/five-star-bancorp-fsbc-scheduled-to-post-quarterly-earnings-on-monday/,Five Star Bancorp (FSBC) Scheduled to Post Quarterly Earnings on Monday,ETF DAILY NEWS
Yahoo,https://www.etfdailynews.com/2023/04/17/nabors-industries-nbr-scheduled-to-post-earnings-on-monday/,Nabors Industries (NBR) Scheduled to Post Earnings on Monday,ETF DAILY NEWS
Yahoo,https://www.etfdailynews.com/2023/04/17/church-dwight-co-inc-nysechd-given-average-recommendation-of-hold-by-analysts/,"Church & Dwight Co., Inc. (NYSE:CHD) Given Average Recommendation of “Hold” by Analysts",ETF DAILY NEWS
Yahoo,https://www.etfdailynews.com/2023/04/11/buckle-nysebke-receives-new-coverage-from-analysts-at-ubs-group/,Buckle (NYSE:BKE) Receives New Coverage from Analysts at UBS Group,ETF DAILY NEWS
Yahoo,https://www.etfdailynews.com/2023/04/17/snap-inc-nysesnap-receives-consensus-recommendation-of-hold-from-brokerages/,Snap Inc. (NYSE:SNAP) Receives Consensus Recommendation of “Hold” from Brokerages,ETF DAILY NEWS
Yahoo,https://www.benzinga.com/news/23/04/31727047/ubs-downgrades-huntington-bancshares-to-neutral,UBS Downgrades Huntington Bancshares to Neutral - Huntington Bancshares (NASDAQ:HBAN),Benzinga
Yahoo,https://www.morningstar.com/news/marketwatch/20230414377/ges-stock-gains-after-ubs-boosts-price-target-by-15,GE's stock gains after UBS boosts price target by 15%,Morningstar
Yahoo,https://www.etfdailynews.com/2023/04/11/mt-bank-nysemtb-downgraded-to-neutral-at-ubs-group/,M&T Bank (NYSE:MTB) Downgraded to “Neutral” at UBS Group,ETF DAILY NEWS
Yahoo,https://www.etfdailynews.com/2023/04/17/aarons-aan-set-to-announce-earnings-on-monday/,Aaron’s (AAN) Set to Announce Earnings on Monday,ETF DAILY NEWS
Yahoo,https://www.benzinga.com/content/seekingalpha-com/23/04/31771805/ubs-said-to-weigh-retaining-credit-suisses-wealth-unit-in-india,UBS said to weigh retaining Credit Suisse's wealth unit in India - UBS Gr (NYSE:UBS),Benzinga
Yahoo,https://www.etfdailynews.com/2023/04/17/jefferies-financial-group-weighs-in-on-federal-realty-investment-trusts-q3-2023-earnings-nysefrt/,Jefferies Financial Group Weighs in on Federal Realty Investment Trust’s Q3 2023 Earnings (NYSE:FRT),ETF DAILY NEWS
Yahoo,https://www.benzinga.com/government/23/04/31760591/credit-suisse-rescue-package-retrospectively-rejected-by-lower-house-of-swiss-parliament-but-theres,"...Lower House Of Swiss Parliament — But There's A Catch - Credit Suisse Group (NYSE:CS), UBS Gr...",Benzinga
Yahoo,https://www.etfdailynews.com/2023/04/17/short-interest-in-blackrock-taxable-municipal-bond-trust-nysebbn-rises-by-220-5/,Short Interest in BlackRock Taxable Municipal Bond Trust (NYSE:BBN) Rises By 220.5%,ETF DAILY NEWS
Yahoo,https://www.etfdailynews.com/2023/04/11/huntington-bancshares-nasdaqhban-downgraded-to-neutral-at-ubs-group/,Huntington Bancshares (NASDAQ:HBAN) Downgraded to “Neutral” at UBS Group,ETF DAILY NEWS
Yahoo,https://www.etfdailynews.com/2023/04/17/short-interest-in-par-pacific-holdings-inc-nyseparr-declines-by-16-5/,"Short Interest in Par Pacific Holdings, Inc. (NYSE:PARR) Declines By 16.5%",ETF DAILY NEWS
Yahoo,https://finance.yahoo.com/news/credit-suisse-had-gigantic-outflows-211518625.html?fr=sycsrp_catchall,Credit Suisse had gigantic outflows in weekend merger with UBS was announced,Reuters via Yahoo Finance
Yahoo,https://www.etfdailynews.com/2023/04/17/jefferies-financial-group-weighs-in-on-federal-realty-investment-trusts-q3-2023-earnings-nysefrt/,Jefferies Financial Group Weighs in on Federal Realty Investment Trust’s Q3 2023 Earnings (NYSE:FRT),ETF DAILY NEWS
Yahoo,https://www.etfdailynews.com/2023/04/11/huntington-bancshares-nasdaqhban-downgraded-to-neutral-at-ubs-group/,Huntington Bancshares (NASDAQ:HBAN) Downgraded to “Neutral” at UBS Group,ETF DAILY NEWS
