Search Engine,Link,Title,Source
Google,https://www.cnbc.com/2023/04/04/credit-suisse-agm-shareholders-demand-answers-over-ubs-rescue-deal.html,"'I am truly sorry': Credit Suisse chair pleads with angry shareholders at 
annual meeting",CNBC
Google,https://www.bloomberg.com/news/articles/2023-03-30/ubs-credit-suisse-merger-worsens-swiss-banking-reputation,UBS-Credit Suisse Merger Worsens Swiss Banking Reputation,Bloomberg.com
Google,https://www.sportsbusinessjournal.com/Daily/Issues/2023/04/10/Facilities/ubs-arena-islanders-naming-rights-mercedes-f1-team-sponsorship.aspx,"UBS says Isles deal 'has delivered,' F1 'important' for brand",Sports Business Journal
Google,https://www.fnlondon.com/articles/trading-places-top-citi-dealmaker-retires-ubss-mercier-leaves-goldman-promotes-somaiya-20230414,"Trading Places: Top Citi dealmaker retires, UBS’s Mercier leaves, Goldman 
promotes Somaiya",Financial News
Google,https://www.reuters.com/business/finance/we-did-not-buy-credit-suisse-only-close-it-ubs-ceo-2023-03-27/,"""We did not buy Credit Suisse only to close it"" - UBS CEO",Reuters
Google,https://www.marketscreener.com/quote/stock/SARTORIUS-AG-436559/news/SARTORIUS-VORZUEGE-UBS-remains-its-Buy-rating-43492996/,SARTORIUS VORZUEGE : UBS remains its Buy rating,Market Screener
Google,https://www.cnbc.com/2023/03/29/a-bad-downgrade-from-ubs-provides-a-buying-opportunity-for-this-turnaround-play.html,"A bad downgrade from UBS provides a buying opportunity for this turnaround 
play",CNBC
Google,https://apnews.com/article/credit-suisse-ubs-swiss-bank-svb-7d4c2c82b6df9830c0254ef0de62e870,"Credit Suisse-UBS deal offers hope, but bank doubts persist",AP News
Google,https://www.businesswire.com/news/home/20230406005435/en/UBS-declares-coupon-payments-on-12-ETRACS-Exchange-Traded-Notes,UBS declares coupon payments on 12 ETRACS Exchange Traded Notes,Business Wire
Google,https://www.marketscreener.com/quote/stock/TESLA-INC-6344549/news/TESLA-Buy-rating-from-UBS-43485998/,TESLA : Buy rating from UBS,Market Screener
Google,https://www.jambase.com/article/bruce-springsteen-marys-place-ubs-arena-setlist-video,"Watch Bruce Springsteen Bring ‘Mary’s Place’ To Long Island At UBS Arena 
Debut",JamBase
Google,https://www.zawya.com/en/business/banking-and-insurance/ubs-considers-retaining-credit-suisses-india-unit-bloomberg-news-lpf0twy9,UBS considers retaining Credit Suisse's India unit: Bloomberg News,ZAWYA
Google,https://fortune.com/2023/03/29/ubs-credit-suisse-sergio-ermotti-colm-kelleher-ralph-hamers-switzerland-brings-back-most-successful-banker-ceo-merged-behemoth/,"Who is Sergio Ermotti? Switzerland’s most successful banker returns to 
steer the merged UBS-Credit Suisse behemoth in its time of need",Fortune
Google,https://www.marketbeat.com/instant-alerts/nyse-ubs-sec-filing-2023-04-14/,UBS Group AG (NYSE:UBS) Position Lifted by Janney Capital Management LLC,MarketBeat
Google,https://www.cnbctv18.com/business/companies/tcs-q4-results-ceo-k-krithivasan-designate-sees-impact-on-some-projects-due-to-credit-suisse-ubs-merger-16394191.htm,"TCS CEO designate sees impact on some projects due to Credit Suisse-UBS 
merger",CNBCTV18.com
Google,https://www.npr.org/2023/03/19/1164600167/banking-troubles-go-global-swiss-force-deal-between-ubs-credit-suisse,UBS to buy troubled Credit Suisse in deal brokered by Swiss government,NPR
Google,https://www.cnbc.com/2023/03/31/ubs-sees-a-rally-in-these-bank-stocks-ahead-as-bank-crisis-appears-contained.html,UBS sees a rally in these bank stocks ahead as bank crisis appears contained,CNBC
Google,https://www.marketscreener.com/news/latest/Diverging-Opinions-Expose-The-Swiss-Franc-Says-UBS--43495517/,"Diverging Opinions Expose The Swiss Franc, Says UBS",Market Screener
Google,https://www.fxstreet.com/news/gold-price-forecast-xau-usds-rally-has-further-to-run-in-the-quarters-ahead-ubs-202304121456,"Gold Price Forecast: XAU/USD’s rally has further to run in the quarters 
ahead – UBS",FXStreet
Google,https://www.ft.com/content/5939b262-999d-442c-b774-f09b72818a8d,Swiss lawmakers vote against Credit Suisse rescue in symbolic protest,Financial Times
Google,https://www.foxbusiness.com/markets/credit-suisse-execs-address-ubs-takeover,Credit Suisse execs address UBS takeover,Fox Business
Google,https://www.marketscreener.com/quote/stock/HERMES-INTERNATIONAL-4657/news/HERMES-UBS-reiterates-its-Buy-rating-43493049/,HERMES : UBS reiterates its Buy rating,Market Screener
Google,https://www.reuters.com/business/finance/ubs-races-seal-credit-suisse-deal-soon-late-april-sources-say-2023-03-23/,"UBS races to seal Credit Suisse deal as soon as late April, sources say",Reuters
Google,https://www.barrons.com/articles/the-new-ubs-is-a-wealth-management-behemoth-thats-a-risk-ec1380e5,The New UBS Is a Wealth Management Behemoth. That’s a Risk.,Barron's
Google,https://www.businessworld.in/article/Federal-Reserve-Approves-UBS-s-Plan-To-Acquire-Credit-Suisse-s-US-Subsidiaries/15-04-2023-473010,"Federal Reserve Approves UBS's Plan To Acquire Credit Suisse's US 
Subsidiaries",BW Businessworld
Google,https://www.cnbc.com/2023/03/29/ubs-sergio-ermotti-switzerland-gets-a-cost-cutting-local-to-restore-its-reputation.html,"'Call of duty': With Sergio Ermotti, Switzerland gets a cost-cutting local 
to restore its reputation",CNBC
Google,https://fortune.com/2023/04/07/commercial-real-estate-banking-crisis-ubs-outlook-office-space-2008-liquidity-crisis/,"The Swiss banking giant that just took over Credit Suisse isn’t afraid of 
empty office buildings. A wave of defaults doesn’t mean a tsunami, it says",Fortune
Google,https://www.marketscreener.com/quote/stock/VINCI-4725/news/VINCI-UBS-keeps-its-Buy-rating-43493043/,VINCI : UBS keeps its Buy rating,Market Screener
Google,https://www.cnn.com/2023/03/24/investing/european-bank-stocks-ubs-deutsche/index.html,"Deutsche Bank, UBS stocks sink as fear of European banking crisis returns",CNN
Google,https://www.nytimes.com/2023/03/29/business/dealbook/ubs-credit-suisse-sergio-ermotti.html,UBS Taps an Ex-C.E.O. to 'Pilot' Its Takeover of Credit Suisse,The New York Times
Google,https://www.scmp.com/business/banking-finance/article/3216458/wealthy-families-middle-east-europe-keen-set-family-offices-hong-kong-ubs-boss-says,"Wealthy families attracted by Hong Kong policies, bay area opportunities: 
UBS",South China Morning Post
Google,https://www.marketwatch.com/story/ubs-may-slash-up-to-30-of-workforce-following-credit-suisse-takeover-report-1d18f3d1,"UBS may slash up to 30% of workforce following Credit Suisse takeover: 
report",MarketWatch
Google,https://www.ft.com/content/0516821d-324a-4d50-b3d9-302cbde8294f,UBS shortlists four consultants for Credit Suisse integration,Financial Times
Google,https://www.politico.eu/article/report-swiss-prosecutors-open-probe-into-ubs-takeover-of-credit-suisse/,Swiss prosecutors open probe into UBS takeover of Credit Suisse,POLITICO
Google,https://www.bloomberg.com/news/articles/2023-03-29/ubs-names-ermotti-to-return-as-ceo-in-wake-of-credit-suisse-deal,UBS Names Sergio Ermotti CEO After Ralph Hamers' Credit Suisse Deal,Bloomberg.com
Google,https://finance.yahoo.com/news/credit-suisse-pays-back-emergency-101613470.html,"Credit Suisse pays back some emergency liquidity, central bank data suggests",Yahoo Finance
Google,https://www.straitstimes.com/business/swiss-vote-against-state-guarantees-for-ubs-takeover-of-credit-suisse-could-be-binding-legal-experts-say,"Swiss vote against state guarantees for UBS takeover of Credit Suisse could 
be binding, say legal experts",The Straits Times
Google,https://www.streetinsider.com/Analyst+Comments/Amazon+%28AMZN%29%3A+UBS+warns+AWS+growth+may+dip+below+10%25/21490385.html,Amazon (AMZN): UBS warns AWS growth may dip below 10%,StreetInsider
Google,https://www.miragenews.com/federal-reserve-approves-ubs-acquisition-of-987002/,Federal Reserve Approves UBS Acquisition of Credit Suisse US Units,Mirage News
Google,https://www.businessinsider.com/swiss-prosecutors-examine-ubs-takeover-of-credit-suisse-report-2023-4,Swiss prosecutors examine UBS takeover of Credit Suisse: report,Business Insider
Google,https://www.marketscreener.com/quote/stock/NOVO-NORDISK-A-S-1412980/news/NOVO-NORDISK-UBS-gives-a-Sell-rating-43495562/,NOVO NORDISK : UBS gives a Sell rating,Market Screener
Google,https://www.reuters.com/breakingviews/ubs-salvages-most-value-credit-suisse-wreck-2023-03-19/,Breakingviews - UBS salvages most value from Credit Suisse wreck,Reuters
Google,https://www.marketscreener.com/quote/stock/UBS-GROUP-AG-19156942/news/UBS-Has-Held-Talks-to-Bring-Back-Former-CFO-Tom-Naratil-Bloomberg-Reports-43497116/,"UBS Has Held Talks to Bring Back Former CFO Tom Naratil, Bloomberg Reports",Market Screener
Google,https://www.marketscreener.com/quote/stock/MICHELIN-CGDE-4672/news/MICHELIN-UBS-reiterates-its-Buy-rating-43486144/,MICHELIN : UBS reiterates its Buy rating,Market Screener
Google,https://www.regulationasia.com/ubs-credit-suisse-merger-continues-to-see-opposition/,UBS-Credit Suisse Merger Continues to See Opposition,Regulation Asia
Google,https://www.forbes.com/sites/marisadellatto/2023/03/19/ubs-agrees-to-buy-embattled-bank-credit-suisse-central-bank-says/,UBS Buying Rival Credit Suisse In $3.2 Billion Rescue Deal,Forbes
Google,https://finance.yahoo.com/news/board-directors-ubs-group-ag-044500954.html,"The Board of Directors of UBS Group AG (UBS) Announces Today That It Has 
Named Sergio P. Ermotti as Its New Group Chief Executive Officer, Effective 
5 April 2023",Yahoo Finance
Google,https://www.ubs.com/global/en/wealth-management/our-approach/marketnews/article.1588687.html,Lower job openings point to slowing US growth,UBS Financial Services
Google,https://www.marketscreener.com/quote/stock/JPMORGAN-CHASE-CO-37468997/news/UBS-Hires-JPMorgan-to-Explore-Credit-Suisse-Domestic-Spin-Off-43493815/,UBS Hires JPMorgan to Explore Credit Suisse Domestic Spin-Off,Market Screener
Google,https://www.reuters.com/business/finance/ubs-swallows-doomed-credit-suisse-casting-shadow-over-switzerland-2023-03-20/,"Analysis: UBS swallows doomed Credit Suisse, casting shadow over Switzerland",Reuters
Google,https://www.efinancialcareers.com/news/2023/03/credit-suisse-ubs-culture,"Morning Coffee: UBS bankers fear “rancid” Credit Suisse bankers will spoil 
things. Male banker accused of intimidating ...",eFinancialCareers
Google,https://www.marketbeat.com/instant-alerts/nasdaq-jd-a-buy-or-sell-right-now-2023-04-13/,UBS Group Lowers JD.com (NASDAQ:JD) to Neutral,MarketBeat
Google,https://www.forbes.com/advisor/au/investing/credit-suisse-shares-all-you-need-to-know/,"UBS TakeOver of Credit Suisse Bank Explained: Everything you Need to Know – 
Forbes Advisor Australia",Forbes
Google,https://www.reuters.com/markets/ubs-buys-back-nearly-3-bln-bonds-issued-under-week-ago-2023-03-22/,UBS buys back bonds days after issue to buoy investor confidence,Reuters
Google,https://beststocks.com/ubs-group-downgrades-rating-on-jd-com-stock-causi/,"UBS Group Downgrades Rating on JD.com Stock, Causing Market Stir and 
Uncertainty for Shareholders",Best Stocks
Google,https://www.politico.eu/article/ubs-buys-credit-suisse-in-rush-deal/,UBS buys Credit Suisse in rush deal,POLITICO
Google,https://www.nytimes.com/2023/03/20/business/dealbook/ubs-bank-stocks-credit-suisse.html,UBS and Other Bank Stocks Fall After Credit Suisse’s Firesale,The New York Times
Google,https://www.finews.com/news/english-news/56744-swiss-parliament-has-blunt-wordsblunt-words-for-ubs,Swiss Parliament has Blunt Words for UBS,finews.com
Google,https://www.investing.com/news/stock-market-news/microsoft-slips-2-as-ubs-cuts-estimates-again-on-too-high-azure-growth-expectations-432SI-3052607,"Microsoft slips 2% as UBS cuts estimates again on 'too high' Azure growth 
expectations By Investing.com",Investing.com
Google,https://www.wsj.com/articles/did-ubs-just-get-the-deal-of-the-decade-b2dd60e,Did UBS Just Get the Deal of the Decade?,The Wall Street Journal
Google,https://www.reuters.com/business/finance/ubs-take-over-credit-suisse-central-bank-2023-03-19/,"UBS to take over Credit Suisse, assume up to 5 billion Swiss francs in 
losses",Reuters
Google,https://www.ubs.com/global/en/wealth-management/our-approach/marketnews/article.1585717.html,Let's chat about ChatGPT | UBS Global,UBS Financial Services
Google,https://www.marketscreener.com/quote/stock/DEUTSCHE-BANK-AG-56358396/news/DEUTSCHE-BANK-AG-UBS-reaffirms-its-Buy-rating-43489024/,DEUTSCHE BANK AG : UBS reaffirms its Buy rating,Market Screener
Google,https://www.reuters.com/markets/deals/ubss-dargan-credit-suisses-mcdonagh-lead-merger-newspaper-2023-03-25/,"UBS's Dargan and Credit Suisse's McDonagh to lead merger, Tages-Anzeiger 
reports",Reuters
Google,https://kalkinemedia.com/au/news/politics-and-international-affairs/federal-reserve-approves-ubs-credit-suisse-deal-in-us,Federal Reserve approves UBS-Credit Suisse deal in US,Kalkine Media
Google,https://news.bloomberglaw.com/business-and-practice/ubs-credit-suisse-deal-aided-by-four-of-biggest-us-law-firms,UBS-Credit Suisse Deal Aided by Four of Biggest US Law Firms,Bloomberg Law News
Google,https://www.ubs.com/global/en/wealth-management/our-approach/marketnews/article.1582167.html,2023 energy outlook: Favoring crude oil | UBS Global,UBS Financial Services
Google,https://www.marketbeat.com/instant-alerts/nyse-now-a-buy-or-sell-right-now-2023-04-14/,ServiceNow (NYSE:NOW) Price Target Raised to $545.00 at UBS Group,MarketBeat
Google,https://www.cnbc.com/2023/03/20/ubs-shares-tumble-after-emergency-rescue-of-rival-credit-suisse.html,"UBS shares reverse losses, Credit Suisse craters 55% after takeover deal",CNBC
Google,https://www.marketbeat.com/instant-alerts/nyse-ubs-sec-filing-2023-04-12/,"Sumitomo Mitsui Trust Holdings Inc. Sells 551715 Shares of UBS Group AG 
(NYSE:UBS)",MarketBeat
Google,https://www.cnbc.com/2023/03/19/ubs-agrees-to-buy-credit-suisse-as-regulators-look-to-shore-up-global-banking-system.html,"UBS buys Credit Suisse for $3.2 billion as regulators look to shore up the 
global banking system",CNBC
Google,https://sourcingjournal.com/topics/retail/retail-store-closings-ubs-inflation-credit-consumer-spending-walmart-target-aeo-428610/,"90000 Stores at Risk of Closing, New Report Warns",Sourcing Journal
Google,https://m.economictimes.com/industry/banking/finance/banking/ubs-weighs-retaining-credit-suisse-unit-serving-indias-rich/articleshow/99425010.cms,UBS weighs retaining Credit Suisse unit serving India’s rich,The Economic Times
Google,https://www.finews.com/news/english-news/56755-iqbal-khan-says-ubs-to-retain-credit-suisse-s-india-wealth-unit,Khan Says UBS May Retain Credit Suisse's India Wealth Unit,Finews Asia
Google,https://www.thenationalnews.com/business/energy/2023/04/12/oil-production-cuts-to-tighten-market-from-may-and-boost-prices-ubs-says/,"Oil production cuts to tighten market from May and boost prices, UBS says",The National
Google,https://www.marketscreener.com/quote/stock/BARRICK-GOLD-CORPORATION-1408870/news/Barrick-Gold-Buy-Rating-Reiterated-by-UBS-Despite-Weak-Q1-Production-Price-Target-Kept-at-US-22-00-43497120/,"Barrick Gold Buy Rating Reiterated by UBS Despite Weak Q1 Production; Price 
Target Kept at US$22.00",Market Screener
Google,https://www.theguardian.com/business/2023/mar/24/ceo-credit-suisse-ulrich-korner-talks-of-his-profound-sadness-over-ubs-takeover,Head of Credit Suisse talks of his profound sadness over UBS takeover,The Guardian
Google,https://www.cnbc.com/2023/01/31/ubs-earnings-q4-and-fy-2022.html,"UBS gets a boost from higher interest rates, but warns of 'uncertain' year 
ahead",CNBC
Google,https://www.cnbc.com/2023/03/28/dividend-stocks-can-beat-the-market-during-recessions-says-ubs.html,"Dividend stocks beat the market during recessions. UBS gives 10 with the 
most upside",CNBC
Google,https://www.usatoday.com/story/money/business/2023/03/19/ubs-announces-takeover-credit-suisse/11504931002/,Banking giant UBS announces takeover of Credit Suisse,USA Today
Google,https://www.cnbc.com/2023/03/24/stock-market-outlook-ubs-picks-shares-recession-nearing.html,UBS says it's 'time for quality' with recession near. 10 stocks to buy,CNBC
Google,https://longisland.news12.com/islanders-host-race-to-the-rink-5k-run-at-ubs-arena-for-childrens-foundation,"Islanders host Race to the Rink 5K run at UBS Arena for Children's 
Foundation",News 12 Long Island
Google,https://www.afr.com/street-talk/ubs-hires-new-head-of-cash-facilitation-20230412-p5czqz,UBS hires new head of cash facilitation,AFR
Google,https://www.bloomberg.com/news/articles/2023-03-24/over-half-of-swiss-disapprove-of-ubs-s-credit-suisse-takeover,Over Half of Swiss Disapprove of UBS's Credit Suisse Takeover,Bloomberg.com
Google,https://www.reuters.com/business/crunch-time-credit-suisse-talks-ubs-seeks-swiss-assurances-2023-03-19/,Central banks try to calm markets after UBS deal to buy Credit Suisse,Reuters
Google,https://www.cnbc.com/2023/03/20/what-ubs-rescue-of-credit-suisse-cs-means-for-markets-and-banks.html,"'Shotgun wedding': What the UBS rescue of Credit Suisse means for global 
markets",CNBC
Google,https://www.reuters.com/business/finance/credit-suisse-ubs-among-banks-facing-uss-russia-sanctions-probe-bloomberg-news-2023-03-23/,"Credit Suisse, UBS among banks facing US's Russia-sanctions probe 
-Bloomberg News",Reuters
Google,https://www.cnbc.com/2023/03/21/ubs-credit-suisse-deal-puts-switzerlands-reputation-on-the-line.html,"'A financial banana republic': UBS-Credit Suisse deal puts Switzerland's 
reputation on the line",CNBC
Google,https://www.reuters.com/markets/deals/ubs-offers-buy-credit-suisse-up-1-billion-ft-2023-03-19/,"UBS offers to buy Credit Suisse for up to $1 billion, Financial Times 
reports",Reuters
Google,https://www.investopedia.com/usb-and-credit-suisse-forced-to-merge-7367988,UBS To Buy Credit Suisse in $3.2 Billion All Stock Deal,Investopedia
Google,https://www.ft.com/content/84406867-0aa9-4d65-9419-2bfa6e7c4001,Inside UBS's takeover of Credit Suisse,Financial Times
Google,https://www.msn.com/en-gb/money/other/federal-reserve-green-lights-ubs-credit-suisse-deal-in-us/ar-AA19Trc0,Federal Reserve green lights UBS-Credit Suisse deal in US,MSN
Google,https://m.timesofindia.com/business/india-business/ubs-mulls-retaining-credit-suisse-unit-serving-indias-rich/articleshow/99427004.cms,UBS mulls retaining Credit Suisse unit serving India’s rich,Times of India
Google,https://www.finews.com/news/english-news/56752-result-extraordiary-session-national-council,Outrage Over UBS Deal Finds a Majority in the Swiss National Council,finews.com
Google,https://www.nytimes.com/2023/03/19/business/ubs-credit-suisse.html,UBS Agrees to Buy Rival Credit Suisse to Shore Up Global Market,The New York Times
Google,https://www.pbs.org/newshour/economy/banking-giant-ubs-announces-acquisition-of-credit-suisse-amid-financial-turmoil,"Banking giant UBS announces acquisition of Credit Suisse amid financial 
turmoil",PBS
Google,https://beststocks.com/baker-tilly-wealth-management-llc-acquires-stake-i-5/,"Baker Tilly Wealth Management LLC Acquires Stake in UBS Group AG, 
Demonstrating Confidence in Financial ...",Best Stocks
Google,https://www.aljazeera.com/economy/2023/3/19/ubs-to-buy-credit-suisse-to-bring-security-and-stability,UBS to buy Credit Suisse for $3.24bn in government-brokered deal,Al Jazeera
Google,https://www.ndtv.com/world-news/swiss-parliament-rejects-129-82-billion-aid-for-credit-suisse-ubs-merger-3943095,Swiss Parliament Rejects $129.82 Billion Aid For Credit Suisse-UBS Merger,NDTV.com
Google,https://www.tipranks.com/news/ubs-group-nyseubs-to-buyback-bonds,UBS Group (NYSE:UBS) to Buy Back Bonds,TipRanks
Google,https://www.ft.com/content/5b677ee0-83d4-47a2-aafa-a88a5b5fae74,Sergio Ermotti returns as UBS chief to steer Credit Suisse takeover,Financial Times
Google,https://finance.yahoo.com/news/how-ubs-boomerang-ceo-could-start-integrating-rival-credit-suisse-135841842.html,"How UBS's boomerang CEO could start integrating rival Credit Suisse and 
calm investors",Yahoo Finance
Google,https://www.businesstoday.in/latest/corporate/story/ubs-considers-retaining-credit-suisses-private-banking-unit-in-india-report-377056-2023-04-12,"UBS considers retaining Credit Suisse’s private banking unit in India: 
Report",Business Today
Google,https://finance.yahoo.com/news/what-wall-street-is-saying-about-ubs-buying-credit-suisse-101159073.html,What Wall Street is saying about UBS buying Credit Suisse,Yahoo Finance
Google,https://www.fnlondon.com/articles/ubss-european-equity-syndicate-head-francois-olivier-mercier-to-depart-20230411,UBS’s European equity syndicate head François-Olivier Mercier to depart,Financial News
Google,https://www.bloomberg.com/news/articles/2023-03-23/credit-suisse-ubs-among-banks-facing-doj-russia-sanctions-probe,"Credit Suisse, UBS Among Banks in DOJ Russia-Sanctions Probe",Bloomberg News
Google,https://www.cbsnews.com/news/ubs-purchase-credit-suisse-fallout-silicon-valley-bank/,UBS to purchase Credit Suisse amid fallout from U.S. bank collapses,CBS News
Google,https://www.nytimes.com/2023/03/22/business/dealbook/credit-suisses-investment-bank.html,UBS Weighs Ending a Plan to Preserve Credit Suisse’s Investment Bank,The New York Times
Google,https://www.reuters.com/markets/deals/ubs-set-talks-with-michael-klein-terminate-credit-suisse-investment-bank-deal-ft-2023-03-21/,"UBS set for talks with Michael Klein to terminate Credit Suisse investment 
bank deal - FT",Reuters
Google,https://www.ft.com/content/ce7d6873-1650-46cb-89c7-0d6064b37ce5,Credit Suisse braced for backlash over UBS rescue at shareholder meeting,Financial Times
Google,https://www.wsj.com/articles/ubs-faces-tough-choices-as-it-weighs-up-credit-suisses-asian-business-dc881ae3,The Future of UBS Rests With Credit Suisse Customers in Asia,The Wall Street Journal
Google,https://www.bloomberg.com/news/articles/2023-03-21/ubs-aims-to-boost-its-dealmaker-ranks-not-spin-out-first-boston,"UBS Aims to Boost Its Dealmaker Ranks, Not Spin Out First Boston",Bloomberg.com
Google,https://www.reuters.com/business/finance/shocked-credit-suisse-staff-fear-uncertain-future-despite-ubs-rescue-deal-2023-03-20/,Stunned Credit Suisse staff fear uncertain future despite UBS rescue deal,Reuters
Google,https://www.npr.org/2023/03/20/1164638197/putin-meets-xi-trump-faces-charges-in-new-york-ubs-buys-credit-suisse,"Putin Meets Xi, Trump Faces Charges in New York, UBS Buys Credit Suisse : 
Up First",NPR
Google,https://www.finews.com/news/english-news/56766-zug-based-finance-boutique-valterna-new-ceo-from-ubs-rene-brunner,Zug-Based Finance Boutique Brings in New CEO From UBS,Finews Asia
Google,https://www.bloomberg.com/news/articles/2023-03-24/ubs-s-khan-vows-retention-packages-for-credit-suisse-asia-staff,UBS's Khan Vows Retention Plans for Credit Suisse Asia Staff,Bloomberg News
Google,https://www.ubs.com/us/en/wealth-management/insights/market-news/article.1587949.html,US equity sectors: Getting more defensive in our sector positioning,UBS Financial Services
Google,https://www.cnn.com/videos/business/2023/03/19/ubs-buys-credit-suisse-bank-acostanr-vpx.cnn,Will UBS move stave off panic? Economy reporter weighs in,CNN
Google,https://www.reuters.com/markets/deals/ubs-regulators-race-seal-credit-suisse-deal-soon-saturday-ft-2023-03-18/,"UBS, regulators race to seal Credit Suisse deal as soon as Saturday, 
Financial Times reports",Reuters
Google,https://www.cbsnews.com/news/credit-suisse-shares-down-ubs-takeover/,Credit Suisse shares slide after UBS buys it for $3.2 billion,CBS News
Google,https://www.globalcapital.com/article/2bix6tnudile6obfaiubk/people-and-markets/deutsche-hires-credit-suisse-m-a-head,Deutsche hires Credit Suisse M&A head,GlobalCapital
Google,https://www.efinancialcareers.com/news/2023/03/ubs-credit-suisse-job-cuts,UBS's plan for Credit Suisse jobs,eFinancialCareers
Google,https://www.reuters.com/markets/credit-suisse-shares-slump-over-61-premarket-trading-after-ubs-deal-2023-03-20/,"Investors punish UBS after Credit Suisse rescue, shares plummet",Reuters
Google,https://www.theguardian.com/business/2023/mar/29/ubs-brings-back-former-chief-oversee-credit-suisse-takeover-sergio-ermotti,UBS brings back former chief to oversee Credit Suisse takeover,The Guardian
Google,https://www.barrons.com/articles/credit-suisse-ubs-merger-wealth-management-stock-362689bb,"UBS-Credit Suisse Deal Creates Wealth Management Titan. Others Stand to 
Gain.",Barron's
Google,https://www.ft.com/content/79c2c955-effc-459b-beea-ee8b6fb28133,Majority of Swiss want new UBS-Credit Suisse mega bank split up,Financial Times
Google,https://www.wsj.com/articles/ubs-in-talks-to-take-over-credit-suisse-ed932b01,UBS Nears Deal to Take Over Credit Suisse,The Wall Street Journal
Google,https://www.cnbc.com/2023/03/19/ubs-offers-to-buy-credit-suisse-for-up-to-1-billion-the-financial-times-reports.html,"UBS offers to buy Credit Suisse for 'substantially' more than $1 billion, 
sources say",CNBC
Google,https://www.socialeurope.eu/the-failure-of-credit-suisse-not-just-a-one-off,The failure of Credit Suisse—not just a one-off,Social Europe
Google,https://www.reuters.com/markets/deals/ubs-agrees-buy-credit-suisse-more-than-2-bln-ft-2023-03-19/,"UBS agrees to buy Credit Suisse for more than $2 billion, Financial Times 
reports",Reuters
Google,https://www.equitypandit.com/us-fed-approves-ubss-plan-to-takeover-us-subsidiaries-of-credit-suisse/,"US Fed Approves UBS's Plan to Takeover US Subsidiaries of Credit Suisse - 
Equitypandit",EquityPandit
Google,https://www.barrons.com/articles/stock-market-movers-a86267f,"First Republic, Credit Suisse, UBS, New York Community, Bed Bath, and More 
Movers",Barron's
Google,https://seekingalpha.com/article/4588741-ubs-swallows-credit-suisse-more-holes-than-cheese,UBS Swallows Credit Suisse: More Holes Than Cheese (NYSE:UBS),Seeking Alpha
