Search Engine,Link,Title,Source
Bing,https://www.thestreet.com/investing/ubs-credit-suisse-merger-may-lead-to-massive-layoffs,UBS-Credit Suisse Merger May Lead to Massive Layoffs,TheStreet.com
Bing,https://www.cnbc.com/2023/03/29/ubs-sergio-ermotti-switzerland-gets-a-cost-cutting-local-to-restore-its-reputation.html,"'Call of duty': With Sergio Ermotti, Switzerland gets a cost-cutting local to restore its reputation",CNBC
Bing,https://www.ubs.com/us/en/asset-management/individual-investors-and-financial-advisors/products/separately-managed-accounts.html,UBS Separately Managed Accounts,UBS
Bing,https://www.businessinsider.com/ubs-buys-credit-suisse-with-bitter-digs-throughout-2023-3,UBS' dramatic takeover of Credit Suisse was the deal neither bank wanted. Here are some of the passive-aggressive digs from both sides.,Business Insider
Bing,https://www.usatoday.com/story/money/business/2023/03/19/ubs-announces-takeover-credit-suisse/11504931002/,Swiss banking giant UBS to buy troubled rival Credit Suisse to avoid a larger global financial crisis,USA Today
Bing,https://www.bloomberg.com/opinion/articles/2023-03-20/ubs-got-credit-suisse-for-almost-nothing,UBS Got Credit Suisse for Almost Nothing,Bloomberg L.P.
Bing,https://www.thestreet.com/investing/ubs-credit-suisse-merger-may-lead-to-massive-layoffs,UBS-Credit Suisse Merger May Lead to Massive Layoffs,TheStreet.com
Bing,https://www.cnbc.com/2023/03/29/ubs-sergio-ermotti-switzerland-gets-a-cost-cutting-local-to-restore-its-reputation.html,"'Call of duty': With Sergio Ermotti, Switzerland gets a cost-cutting local to restore its reputation",CNBC
Bing,https://www.forbes.com/sites/jackkelly/2023/03/19/ubs-buys-beleaguered-credit-suisse-to-avoid-a-potential-financial-contagion-large-layoffs-are-likely/,UBS To Buy Beleaguered Credit Suisse To Avoid A Potential Financial Contagion—Large Layoffs Are Likely,Forbes
Bing,https://247wallst.com/investing/2023/03/21/why-credit-suisses-ubs-deal-seems-like-an-extraordinary-bailout/,Why Credit Suisse's UBS Deal Seems Like an Extraordinary Bailout,24/7 Wall St
Bing,https://www.morningstar.com/articles/1144954/why-the-ubs-takeover-of-credit-suisse-is-bad-for-bondholders,Why the UBS Takeover of Credit Suisse Is Bad for Bondholders,Morningstar
Bing,https://www.ubs.com/us/en/wealth-management/about-us/disclosure-documents.html,Disclosure Documents,UBS
Bing,https://www.cnbc.com/2023/03/20/ubs-shares-tumble-after-emergency-rescue-of-rival-credit-suisse.html,"UBS shares reverse losses, Credit Suisse craters 55% after takeover deal",CNBC
Bing,https://edition.cnn.com/2023/03/19/business/credit-suisse-ubs-rescue/index.html,UBS is buying Credit Suisse in bid to halt banking crisis,CNN
Bing,https://www.financial-planning.com/news/ubs-touts-advisor-recruiting-website-as-it-buys-credit-suisse,UBS's recruiting website dances with forced Credit Suisse marriage and field leadership cuts,Financial Planning
Bing,https://abcnews.go.com/International/wireStory/swiss-hold-news-conference-amid-credit-suisse-troubles-97973425,UBS to buy Credit Suisse for nearly $3.25B to calm turmoil,ABC News
Bing,https://www.cnbc.com/2023/03/29/stock-markets-ubs-gets-a-new-old-group-ceo.html,CNBC Daily Open: UBS gets a new (old) Group CEO,CNBC
Bing,https://www.bloomberg.com/news/articles/2023-03-22/ubs-offers-to-buy-back-some-of-its-own-bail-in-notes,UBS Offers Bond Buyback After Takeover Raised Its Credit Risk,Bloomberg L.P.
Bing,https://seekingalpha.com/news/3948706-ubs-confirms-deal-to-acquire-credit-suisse-for-325b-in-stock,UBS confirms deal to acquire Credit Suisse for $3.25B in stock,Seeking Alpha
Bing,https://www.ubs.com/global/en/media/display-page-ndp/en-20230319-tree.html,UBS to acquire Credit Suisse,UBS
Bing,https://www.ubs.com/global/en/sustainability-impact.html,Sustainability at UBS,UBS
Bing,https://www.cnbc.com/2023/03/19/ubs-offers-to-buy-credit-suisse-for-up-to-1-billion-the-financial-times-reports.html,"UBS offers to buy Credit Suisse for 'substantially' more than $1 billion, sources say",CNBC
Bing,https://www.businessinsider.com/ubs-acquisition-credit-suisse-swiss-banking-wealth-management-2023-3,Swiss Miss: Why UBS's deal with Credit Suisse will threaten its hold on rich clients,Business Insider
Bing,https://markets.businessinsider.com/news/stocks/ubs-safest-bank-too-big-to-fail-credit-suisse-rescue-2023-3,"UBS is now 'the world's safest bank' for depositors because Switzerland has made it too big to fail, analyst says",Business Insider
Bing,https://markets.businessinsider.com/news/stocks/ubs-credit-suisse-banking-crisis-markets-economy-inflation-recession-rates-2023-3,UBS is set to buy Credit Suisse for $3.2 billion. The megadeal could make the banking crisis worse.,Business Insider
Bing,https://www.cnbc.com/2023/03/19/ubs-reportedly-offers-to-buy-credit-suisse-for-up-to-1-billion.html,UBS reportedly offers to buy Credit Suisse for up to $1 billion,CNBC
Bing,https://www.latimes.com/business/story/2023-03-19/banking-giant-ubs-acquiring-credit-suisse-to-rein-in-turmoil,UBS to buy Credit Suisse for nearly $3.25 billion to calm turmoil,Los Angeles Times
Bing,https://www.reuters.com/business/crunch-time-credit-suisse-talks-ubs-seeks-swiss-assurances-2023-03-19/,Central banks try to calm markets after UBS deal to buy Credit Suisse,Reuters
Bing,https://www.cnbc.com/2023/03/28/dividend-stocks-can-beat-the-market-during-recessions-says-ubs.html,Dividend stocks beat the market during recessions. UBS gives 10 with the most upside,CNBC
Bing,https://www.cnbc.com/2023/03/30/stocks-moving-big-midday-bbby-evgo-ubs-and-more.html,"Stocks making the biggest moves midday: Bed Bath & Beyond, EVgo, UBS and more",CNBC
Bing,https://abcnews.go.com/Business/wireStory/ubs-buy-credit-suisse-325b-calm-turmoil-97980139,"Credit Suisse-UBS deal offers hope, but bank doubts persist",ABC News
Bing,https://www.ubs.com/us/en/wealth-management/who-we-serve/individuals-and-families/banking/cards.html,UBS Credit and Debit Cards,UBS
Bing,https://abcnews.go.com/International/wireStory/ubs-buy-credit-suisse-325b-calm-turmoil-97980137,"Credit Suisse-UBS deal offers hope, but bank doubts persist",ABC News
Bing,https://www.ubs.com/global/en/careers/life-at-ubs.html,Your career at UBS,UBS
Bing,https://www.ubs.com/us/en/wealth-management/my-money-moves.html,Own your worth,UBS
Bing,https://www.cnn.com/2023/03/18/business/credit-suisse-crisis-ubs/index.html,Exclude (no logo),CNN
Bing,https://www.ubs.com/us/en/real-estate.html,Real Estate & Private Markets,UBS
Bing,https://www.ubs.com/us/en/wealth-management/insights/investor-mindset.html,On the minds of investors,UBS
Bing,https://www.ubs.com/us/en/wealth-management/misc/account-sweep-yields.html,Sweep and Savings Yield,UBS
Bing,https://www.ubs.com/us/en/wealth-management/information/email-disclaimer.html,E-mail Disclaimer,UBS
Bing,https://www.ubs.com/global/en/investor-relations/financial-information/quarterly-reporting.html,Quarterly reporting,UBS
Bing,https://www.ubs.com/us/en/wealth-management/who-we-serve/individuals-and-families/banking/cards/personal.html,UBS credit and debit cards,UBS
Bing,https://www.ubs.com/us/en/wealth-management/who-we-serve/individuals-and-families/banking/cash-management/ubs-mobile-app.html,Go Mobile.,UBS
Bing,https://www.investopedia.com/terms/u/ubs.asp,"UBS: Definition, Bank History, Financial Services",Investopedia
Bing,https://www.ubs.com/us/en/wealth-management/who-we-serve/individuals-and-families/banking/cards/business.html,Do business your way,UBS
Bing,https://www.ubs.com/us/en/wealth-management/financial-advisor-experience/articles/recruiting-leadership-and-accolades.html,UBS global leadership,UBS
Bing,https://www.cnn.com/business/live-news/stock-market-credit-suisse-bank-merger-03-20-23/index.html,Latest on the banking crisis and global markets,CNN
Bing,https://www.ubs.com/global/en/investment-bank/cmci/ubs-strategies.html,UBS Strategies,UBS
Bing,https://www.ubs.com/us/en/wealth-management/who-we-serve/individuals-and-families/banking/cash-management.html,Cash management,UBS
Bing,https://www.ubs.com/global/en/sustainability-impact/globalvisionaries/about.html,UBS Global Visionaries,UBS
Bing,https://www.ubs.com/us/en/wealth-management/information/order-routing-disclosure.html,Order Routing Disclosure,UBS
Bing,https://www.ubs.com/us/en/wealth-management/who-we-serve/individuals-and-families/banking/deposits.html,Make the most of your cash,UBS
Bing,https://www.ubs.com/global/en.html,UBS Global,UBS
Bing,https://www.ubs.com/us/en/wealth-management/who-we-serve/individuals-and-families/banking/commercial-real-estate.html,Built for you,UBS
Bing,https://www.ubs.com/microsites/wma/insights/en/investing/2020/cash-boost.html,A smart way to earn more.,UBS
Bing,https://www.ubs.com/microsites/ubs-nashville/en/about-us.html,Reimagine yourself right here.,UBS
Bing,https://www.ubs.com/us/en/wealth-management/ubs-arena.html,Welcome to UBS Arena,UBS
Bing,https://www.ubs.com/us/en/wealth-management/who-we-serve/individuals-and-families/banking/sec-lending.html,Securities-backed lending,UBS
Bing,https://www.ubs.com/us/en/wealth-management/podcast/steven-young.html,UBS Advisor Podcasts,UBS
Bing,https://www.reuters.com/business/finance/ubs-swallows-doomed-credit-suisse-casting-shadow-over-switzerland-2023-03-20/,"Analysis: UBS swallows doomed Credit Suisse, casting shadow over Switzerland",Reuters
Bing,https://www.cnbc.com/2023/03/29/ubs-names-sergio-ermotti-as-its-new-ceo-following-acquisition-of-credit-suisse.html,Sergio Ermotti returns as UBS CEO to oversee Credit Suisse takeover,CNBC
Bing,https://www.benzinga.com/analyst-ratings/analyst-color/23/03/31421817/ubs-analyst-turns-bullish-following-credit-suisse-takeover-projects-8b-in-synergies,"$8 Billion In Savings? The 'Impeccable' Logic Of UBS-Credit Suisse Deal, According To One Analyst",Benzinga.com
Bing,https://www.forbes.com/sites/marisadellatto/2023/03/19/ubs-agrees-to-buy-embattled-bank-credit-suisse-central-bank-says/,UBS Buying Rival Credit Suisse In $3.2 Billion Rescue Deal,Forbes
Bing,https://www.cnbc.com/2023/03/20/what-ubs-rescue-of-credit-suisse-cs-means-for-markets-and-banks.html,'Shotgun wedding': What the UBS rescue of Credit Suisse means for global markets,CNBC
Bing,https://www.bloomberg.com/news/articles/2023-03-24/ubs-s-khan-vows-retention-packages-for-credit-suisse-asia-staff,UBS’s Khan Vows Retention Plans for Credit Suisse Asia Staff,Bloomberg L.P.
Bing,https://www.bloomberg.com/opinion/articles/2023-03-23/ubs-switzerland-and-those-angry-at1-investors,"UBS, Switzerland and Those Angry AT1 Investors",Bloomberg L.P.
Bing,https://www.ubs.com/us/en/wealth-management/my-money-moves.html,Own your worth,UBS
Bing,https://www.ubs.com/us/en/wealth-management/misc/account-sweep-yields.html,Sweep and Savings Yield,UBS
Bing,https://www.ubs.com/global/en/investor-relations/financial-information/quarterly-reporting.html,Quarterly reporting,UBS
Yahoo,https://www.barrons.com/articles/alibaba-jd-baidu-chinese-stocks-23a08c41?siteid=yhoof2&yptr=yahoo,Good News for Alibaba and Other Chinese Stocks. UBS Sees 3 Reasons to Be Bullish.,Barrons.com
Yahoo,https://www.marketwatch.com/story/credit-suisse-fund-outflows-widen-to-5-6-billion-following-ubs-tie-up-36297874?mod=mw_latestnews,Credit Suisse fund outflows widen to $5.6 billion following UBS tie-up,Market Watch
Yahoo,https://www.etfdailynews.com/2023/04/12/investors-buy-high-volume-of-ubs-group-call-options-nyseubs/,Investors Buy High Volume of UBS Group Call Options (NYSE:UBS),ETF DAILY NEWS
Yahoo,https://investorplace.com/2023/04/look-beyond-the-risks-and-buy-ubs-stock/,Don't Overlook Undervalued Banking Giant UBS Stock,InvestorPlace
Yahoo,https://www.washingtonpost.com/business/2023/04/17/credit-suisse-collapse-european-bank-debt-starts-to-shake-off-its-hangover/89f3616a-dcd6-11ed-a78e-9a7c2418b00c_story.html,Analysis | European Bank Debt Starts to Shake Off Its Swiss Hangover,Washington Post
Yahoo,https://www.msn.com/en-ca/money/topstories/federal-reserve-green-lights-ubs-credit-suisse-deal-in-us/ar-AA19Skya,Federal Reserve green lights UBS-Credit Suisse deal in US,MSN News
Yahoo,https://www.etfdailynews.com/2023/04/17/strs-ohio-grows-holdings-in-constellium-se-nysecstm/,Strs Ohio Grows Holdings in Constellium SE (NYSE:CSTM),ETF DAILY NEWS
Yahoo,https://news.yahoo.com/swiss-vote-against-ubs-deal-131801231.html?fr=sycsrp_catchall,"Swiss Vote Against UBS Deal Could Be Binding, Legal Experts Say",Bloomberg via Yahoo News
Yahoo,https://www.msn.com/en-in/money/topstories/us-federal-reserve-gives-nod-to-acquisition-of-us-subsidiaries-of-credit-suisse-by-ubs/ar-AA19SJVR?ocid=FinanceShimLayer,US Federal Reserve gives nod to acquisition of US subsidiaries of Credit Suisse by UBS,MSN News
Yahoo,https://seekingalpha.com/news/3956711-fed-approves-ubs-acquisition-of-credit-suisse-us-business,Fed approves UBS' acquisition of Credit Suisse's U.S. business,Seeking Alpha
Yahoo,https://seekingalpha.com/news/3956008-ubs-said-to-weigh-retaining-credit-suisses-wealth-unit-in-india,UBS said to weigh retaining Credit Suisse's wealth unit in India (NYSE:UBS),Seeking Alpha
Yahoo,https://www.msn.com/en-in/money/topstories/ubs-considers-retaining-credit-suisse-s-private-banking-unit-in-india-report/ar-AA19Kh1B?ocid=FinanceShimLayer,UBS considers retaining Credit Suisse's private banking unit in India: Report,MSN News
Yahoo,https://whtc.com/2023/04/13/ubs-has-hired-jpmorgan-to-explore-c-suisse-domestic-spin-off-swiss-media/,UBS has hired JPMorgan to explore C.Suisse domestic spin-off -Swiss media,WHTC 1450 Holland
Yahoo,https://www.etfdailynews.com/2023/04/17/united-parcel-service-inc-nyseups-receives-consensus-rating-of-hold-from-analysts/,"United Parcel Service, Inc. (NYSE:UPS) Receives Consensus Rating of “Hold” from Analysts",ETF DAILY NEWS
Yahoo,https://www.etfdailynews.com/2023/04/11/baker-tilly-wealth-management-llc-takes-198000-position-in-ubs-group-ag-nyseubs/,"Baker Tilly Wealth Management LLC Takes $198,000 Position in UBS Group AG (NYSE:UBS)",ETF DAILY NEWS
Yahoo,https://www.benzinga.com/content/investorplace-com/23/04/31807584/dont-overlook-undervalued-banking-giant-ubs-stock,"Don't Overlook Undervalued Banking Giant UBS Stock - Credit Suisse Group (NYSE:CS), UBS Gr (NYSE:UBS...",Benzinga
Yahoo,https://www.bizjournals.com/washington/news/2023/04/12/ubs-skanska-dc-office.html,UBS to relocate D.C. office to Skanska's trophy 17xM - Washington Business Journal,The Business Journals
Yahoo,https://finance.yahoo.com/news/ubs-mulls-keeping-credit-suisse-154135669.html?fr=sycsrp_catchall,UBS Mulls Keeping Credit Suisse Private Wealth Unit Targeting India's Wealthy Diaspora,Benzinga via Yahoo Finance
Yahoo,https://www.etfdailynews.com/2023/04/17/international-consolidated-airlines-group-s-a-otcmktsicagy-given-consensus-rating-of-hold-by-brokerages/,International Consolidated Airlines Group S.A. (OTCMKTS:ICAGY) Given Consensus Rating of “Hold” by...,ETF DAILY NEWS
Yahoo,https://www.etfdailynews.com/2023/04/17/natixis-advisors-l-p-has-3-70-million-stock-holdings-in-novanta-inc-nasdaqnovt/,Natixis Advisors L.P. Has $3.70 Million Stock Holdings in Novanta Inc. (NASDAQ:NOVT),ETF DAILY NEWS
Yahoo,https://www.etfdailynews.com/2023/04/16/braskem-nysebak-raised-to-buy-at-ubs-group/,Braskem (NYSE:BAK) Raised to “Buy” at UBS Group,ETF DAILY NEWS
Yahoo,https://www.investing.com/news/economy/fed-approves-ubscredit-suisse-deal-in-us-3056082,Federal Reserve green lights UBS-Credit Suisse deal in US By Reuters,Investing.com
Yahoo,https://finance.yahoo.com/news/swiss-lower-house-votes-second-125103244.html?fr=sycsrp_catchall,Swiss Lower House Censures UBS Guarantees in Symbolic Vote,Bloomberg via Yahoo Finance
Yahoo,https://www.streetinsider.com/Fed/Fed+announces+its+approval+for+UBS+Group+AG+%28UBS%29+to+acquire+the+U.S.+subsidiaries+of+Credit+Suisse+%28CS%29/21507327.html,Fed announces its approval for UBS Group AG (UBS) to acquire the U.S. subsidiaries of Credit Suisse...,StreetInsider
Yahoo,https://www.marketwatch.com/story/ubs-taps-jpmorgan-to-explore-possible-ipo-of-credit-suisses-domestic-business-report-e7840b30,UBS taps JPMorgan to explore possible IPO of Credit Suisse’s domestic business: report,Market Watch
Yahoo,https://www.etfdailynews.com/2023/04/17/new-york-state-teachers-retirement-system-grows-stock-holdings-in-hub-group-inc-nasdaqhubg/,"New York State Teachers Retirement System Grows Stock Holdings in Hub Group, Inc. (NASDAQ:HUBG)",ETF DAILY NEWS
Yahoo,https://www.forbes.com/sites/joanverdon/2023/04/12/50000-stores-to-close-by-2027-due-to-spending-shifts-tight-credit/,"50,000 U.S. Stores Could Close By 2027 Because Of Spending Shifts And Tight Credit, UBS Forecasts",Forbes
Yahoo,https://news.yahoo.com/swiss-president-defends-ubs-credit-093824507.html?fr=sycsrp_catchall,Swiss Parliament’s Lower House Debates UBS Deal After Upper House Nod (1),Bloomberg via Yahoo News
Yahoo,https://money.usnews.com/investing/news/articles/2023-04-14/fed-approves-ubs-credit-suisse-deal-in-us,Federal Reserve Approves UBS-Credit Suisse Deal in US,US News & World Report
Yahoo,https://www.etfdailynews.com/2023/04/16/servicenow-nysenow-pt-raised-to-545-00-at-ubs-group/,ServiceNow (NYSE:NOW) PT Raised to $545.00 at UBS Group,ETF DAILY NEWS
Yahoo,https://www.investing.com/news/stock-market-news/ubs-analysts-believe-earnings-season-may-not-be-a-negative-catalyst-for-the-market-432SI-3054925,UBS analysts believe earnings season may not be a negative catalyst for the market By Investing.com,Investing.com
Yahoo,https://www.reuters.com/markets/deals/fed-approves-ubs-credit-suisse-deal-us-2023-04-14/,Federal Reserve green lights UBS-Credit Suisse deal in US,Reuters
Yahoo,https://seekingalpha.com/news/3956034-credit-suisse-ubs-deal-voted-down-by-swiss-parliaments-lower-house,"Credit Suisse, UBS deal voted down by Swiss parliament's lower house (NYSE:CS)",Seeking Alpha
Yahoo,https://www.marketwatch.com/story/ubs-upgrades-goldman-sachs-to-buy-from-hold-on-attractive-valuation-lower-risk-profile-61128cda,"UBS upgrades Goldman Sachs to buy from hold on attractive valuation, lower risk profile",Market Watch
Yahoo,https://www.reuters.com/breakingviews/ubs-can-score-quick-win-with-swiss-sale-2023-04-12/,UBS can score a quick win with Swiss sale,Reuters
Yahoo,https://www.marketwatch.com/story/fed-approves-ubss-acquisition-of-u-s-subsidiaries-of-credit-suisse-fae3e00d,Fed approves UBS’s acquisition of U.S. subsidiaries of Credit Suisse,Market Watch
Yahoo,https://www.benzinga.com/content/www-tipranks-com/23/04/31737649/j-p-morgan-reaffirms-their-buy-rating-on-ubs-group-ag-ubs,J.P. Morgan Reaffirms Their Buy Rating on UBS Group AG (UBS) - UBS Gr (NYSE:UBS),Benzinga
Yahoo,https://www.morningstar.com/news/dow-jones/202304161265/mitsubishi-ufj-morgan-stanley-securities-sold-y95-billion-of-credit-suisse-at1-bonds,Mitsubishi UFJ Morgan Stanley Securities Sold Y95 Billion of Credit Suisse AT1 Bonds,Morningstar
Yahoo,https://za.investing.com/news/ubs-analysts-believe-earnings-season-may-not-be-a-negative-catalyst-for-the-market-432SI-2736628,UBS analysts believe earnings season may not be a negative catalyst for the market By Investing.com,Investing.com
Yahoo,https://www.benzinga.com/content/www-investorsobserver-com/23/04/31741465/ubs-group-ag-ubs-has-risen-2-17-tuesday-in-premarket-trading,UBS Group AG (UBS) has risen 2.17% Tuesday In Premarket Trading - UBS Gr (NYSE:UBS),Benzinga
Yahoo,https://za.investing.com/news/ubs-analysts-believe-earnings-season-may-not-be-a-negative-catalyst-for-the-market-432SI-2736628,UBS analysts believe earnings season may not be a negative catalyst for the market By Investing.com,Investing.com
Yahoo,https://www.etfdailynews.com/2023/04/17/nokia-oyj-nysenok-receives-consensus-rating-of-moderate-buy-from-brokerages/,Nokia Oyj (NYSE:NOK) Receives Consensus Rating of “Moderate Buy” from Brokerages,ETF DAILY NEWS
Yahoo,https://www.etfdailynews.com/2023/04/17/post-holdings-inc-nysepost-receives-average-recommendation-of-moderate-buy-from-brokerages/,"Post Holdings, Inc. (NYSE:POST) Receives Average Recommendation of “Moderate Buy” from Brokerages",ETF DAILY NEWS
Yahoo,https://www.morningstar.com/news/dow-jones/202304161279/correction-to-mitsubishi-ufj-morgan-stanley-securities-article,Correction to Mitsubishi UFJ Morgan Stanley Securities Article,Morningstar
Yahoo,https://www.benzinga.com/content/www-tipranks-com/23/04/31786584/ubs-sticks-to-their-buy-rating-for-stellantis-stla,UBS Sticks to Their Buy Rating for Stellantis (STLA) - Stellantis (NYSE:STLA),Benzinga
Yahoo,https://finance.yahoo.com/news/ubs-considers-retaining-credit-suisses-050818857.html?fr=sycsrp_catchall,UBS considers retaining Credit Suisse's India unit - Bloomberg News,Reuters via Yahoo Finance
Yahoo,https://www.reuters.com/world/india/ubs-considers-retaining-credit-suisses-india-unit-bloomberg-news-2023-04-12/,UBS considers retaining Credit Suisse's India unit - Bloomberg News,Reuters
Yahoo,https://finance.yahoo.com/news/brace-stock-market-volatility-persist-174933439.html?fr=sycsrp_catchall,Brace for stock-market volatility to persist this year as investors get bombarded with economic...,Business Insider via Yahoo Finance
Yahoo,https://www.cnbc.com/2023/04/12/ubs-says-its-time-to-buy-this-banking-giant-with-very-low-risk-ahead.html,UBS says it's time to buy this banking giant with very low risk ahead,CNBC
Yahoo,https://www.cnbc.com/2023/04/10/ubs-says-gains-will-be-limited-for-this-banking-stock-after-recent-crisis.html,"UBS downgrades this regional bank, says 'structural uncertainties' will pressure the stock",CNBC
Yahoo,https://www.etfdailynews.com/2023/04/17/plains-gp-holdings-l-p-nysepagp-given-consensus-rating-of-moderate-buy-by-brokerages/,"Plains GP Holdings, L.P. (NYSE:PAGP) Given Consensus Rating of âModerate Buyâ by Brokerages",ETF DAILY NEWS
Yahoo,https://www.etfdailynews.com/2023/04/17/corning-incorporated-nyseglw-shares-sold-by-natixis-advisors-l-p/,Corning Incorporated (NYSE:GLW) Shares Sold by Natixis Advisors L.P.,ETF DAILY NEWS
Yahoo,https://www.etfdailynews.com/2023/04/17/jack-henry-associates-inc-nasdaqjkhy-shares-sold-by-exchange-traded-concepts-llc/,"Jack Henry & Associates, Inc. (NASDAQ:JKHY) Shares Sold by Exchange Traded Concepts LLC",ETF DAILY NEWS
Yahoo,https://www.etfdailynews.com/2023/04/17/boston-financial-mangement-llc-cuts-position-in-johnson-johnson-nysejnj/,Boston Financial Mangement LLC Cuts Position in Johnson & Johnson (NYSE:JNJ),ETF DAILY NEWS
Yahoo,https://www.etfdailynews.com/2023/04/17/the-chemours-company-nysecc-holdings-decreased-by-comerica-bank/,The Chemours Company (NYSE:CC) Holdings Decreased by Comerica Bank,ETF DAILY NEWS
Yahoo,https://www.etfdailynews.com/2023/04/17/exchange-traded-concepts-llc-grows-stock-position-in-invesco-ltd-nyseivz/,Exchange Traded Concepts LLC Grows Stock Position in Invesco Ltd. (NYSE:IVZ),ETF DAILY NEWS
Yahoo,https://www.benzinga.com/content/www-investorsobserver-com/23/04/31790111/where-will-ubs-group-ag-ubs-stock-go-next-after-it-is-higher-by-3-03-in-a-week,Where Will UBS Group AG (UBS) Stock Go Next After It Is Higher By 3.03% in a Week? - UBS Gr (NYSE:...,Benzinga
Yahoo,https://www.barrons.com/articles/the-dollars-era-of-outperformance-is-ending-how-to-step-away-fffae76d?siteid=yhoof2&yptr=yahoo,"4 Ways to Reduce Dollar Exposure, According to UBS",Barrons.com
Yahoo,https://www.etfdailynews.com/2023/04/17/unilever-lonulvr-reaches-new-12-month-high-at-4338-72/,"Unilever (LON:ULVR) Reaches New 12-Month High at $4,338.72",ETF DAILY NEWS
Yahoo,https://www.etfdailynews.com/2023/04/17/natixis-advisors-l-p-buys-9031-shares-of-columbia-sportswear-nasdaqcolm/,"Natixis Advisors L.P. Buys 9,031 Shares of Columbia Sportswear (NASDAQ:COLM)",ETF DAILY NEWS
Yahoo,https://www.investing.com/news/stock-market-news/servicenow-sinks-as-ubs-notes-weaker-partner-checks-432SI-3055899,ServiceNow sinks as UBS notes weaker partner checks By Investing.com,Investing.com
Yahoo,https://www.benzinga.com/content/www-investorsobserver-com/23/04/31764822/should-you-buy-ubs-group-ag-ubs-stock-wednesday-morning,Should You Buy UBS Group AG (UBS) Stock Wednesday Morning? - UBS Gr (NYSE:UBS),Benzinga
Yahoo,https://www.benzinga.com/news/23/04/31786102/ubs-downgrades-jd-com-to-neutral-lowers-price-target-to-43,"UBS Downgrades JD.com to Neutral, Lowers Price Target to $43 - JD.com (NASDAQ:JD)",Benzinga
Yahoo,https://www.morningstar.com/news/business-wire/20230410005234/ubs-advisors-drew-freides-and-michael-kanigher-named-to-the-barrons-top-1200-advisors-list,UBS advisors Drew Freides and Michael Kanigher named to the Barron’s Top 1200 Advisors list,Morningstar
Yahoo,https://news.yahoo.com/swiss-parliament-grapples-compromise-ubs-072753540.html?fr=sycsrp_catchall,Swiss Parliament Nears Deal on UBS Guarantees as MPs Change Vote,Bloomberg via Yahoo News
Yahoo,https://www.benzinga.com/content/www-investorsobserver-com/23/04/31807350/should-you-hold-ubs-group-ag-ubs-in-banks-diversified-industry,Should You Hold UBS Group AG (UBS) in Banks - Diversified Industry? - UBS Gr (NYSE:UBS),Benzinga
Yahoo,https://www.yahoo.com/lifestyle/50-000-stores-could-close-193032161.html?fr=sycsrp_catchall,"50,000 Stores Could Close in the Next 5 Years, UBS Says",Footwear News via Yahoo News
Yahoo,https://www.barrons.com/articles/mid-cap-banks-profits-deposits-funding-crisis-5aae9532?siteid=yhoof2&yptr=yahoo,"Mid-Cap Banks Face New Pressure on Profits After ‘Crisis,’ UBS Warns",Barrons.com
Yahoo,https://www.barrons.com/articles/top-100-private-wealth-management-teams-ubs-5e448b0e?siteid=yhoof2&yptr=yahoo,How This UBS Megateam Is Building Portfolios Now,Barrons.com
Yahoo,https://www.pr.com/press-release/884341,...Funding Directly to Ukrainian NGOs Struggling to Access International Aid; $2 Million Committed...,PR.com
