Search Engine,Link,Title,Source
Yahoo,https://www.benzinga.com/news/23/04/31763994/ubs-mulls-keeping-credit-suisse-private-wealth-unit-targeting-indias-wealthy-diaspora,UBS Mulls Keeping Credit Suisse Private Wealth Unit Targeting India's Wealthy Diaspora - UBS Gr...,Benzinga
Yahoo,https://www.benzinga.com/content/www-investorsobserver-com/23/04/31741465/ubs-group-ag-ubs-has-risen-2-17-tuesday-in-premarket-trading,UBS Group AG (UBS) has risen 2.17% Tuesday In Premarket Trading - UBS Gr (NYSE:UBS),Benzinga
Yahoo,https://www.barrons.com/articles/mid-cap-banks-profits-deposits-funding-crisis-5aae9532?siteid=yhoof2&yptr=yahoo,"Mid-Cap Banks Face New Pressure on Profits After ‘Crisis,’ UBS Warns",Barrons.com
Yahoo,https://www.yahoo.com/lifestyle/50-000-stores-could-close-193032161.html?fr=sycsrp_catchall,"50,000 Stores Could Close in the Next 5 Years, UBS Says",Footwear News via Yahoo News
Yahoo,https://finance.yahoo.com/news/wealthy-families-middle-east-europe-093000248.html?fr=sycsrp_catchall,"Wealthy families from Middle East, Europe keen to set up family offices in Hong Kong, UBS boss says",South China Morning Post via Yahoo Finance
Yahoo,https://www.benzinga.com/content/www-tipranks-com/23/04/31716392/analysts-top-financial-picks-ubs-group-ag-ubs-equitable-holdings-eqh,"Analysts' Top Financial Picks: UBS Group AG (UBS), Equitable Holdings (EQH) - UBS Gr (NYSE:UBS),...",Benzinga
Yahoo,https://www.etfdailynews.com/2023/04/08/ubs-group-boosts-alphabet-nasdaqgoog-price-target-to-123-00/,UBS Group Boosts Alphabet (NASDAQ:GOOG) Price Target to $123.00,ETF DAILY NEWS
Yahoo,https://in.investing.com/news/google-inc-receives-investment-bank-analyst-rating-update-3594613,UBS maintains Alphabet A at Buy,Investing.com
Yahoo,https://www.msn.com/en-us/money/topstocks/ubs-maintains-oneok-oke-neutral-recommendation/ar-AA19yH9J?ocid=FinanceShimLayer,UBS Maintains ONEOK (OKE) Neutral Recommendation,MSN News
Yahoo,https://www.ibtimes.com/european-exchanges-defensive-appeal-attracts-investors-after-bank-turmoil-3685926,European Exchanges' Defensive Appeal Attracts Investors After Bank Turmoil,International Business Times
Yahoo,https://www.investing.com/news/stock-market-news/swiss-finance-minister-sees-no-stumbling-blocks-to-ubs-takeover-of-credit-suisse-3051006,Swiss finance minister sees no 'stumbling blocks' to UBS takeover of Credit Suisse By Reuters,Investing.com
Yahoo,https://www.etfdailynews.com/2023/04/14/the-goldman-sachs-group-cuts-sterling-check-nasdaqster-price-target-to-16-00/,The Goldman Sachs Group Cuts Sterling Check (NASDAQ:STER) Price Target to $16.00,ETF DAILY NEWS
Yahoo,https://www.msn.com/en-us/money/topstocks/ubs-maintains-procter-gamble-pg-buy-recommendation/ar-AA19yOxj?ocid=FinanceShimLayer,UBS Maintains Procter & Gamble (PG) Buy Recommendation,MSN News
Yahoo,https://www.etfdailynews.com/2023/04/08/ubs-group-raises-procter-gamble-nysepg-price-target-to-170-00/,UBS Group Raises Procter & Gamble (NYSE:PG) Price Target to $170.00,ETF DAILY NEWS
Yahoo,https://www.etfdailynews.com/2023/04/08/ubs-group-raises-procter-gamble-nysepg-price-target-to-170-00/,UBS Group Raises Procter & Gamble (NYSE:PG) Price Target to $170.00,ETF DAILY NEWS
Yahoo,https://www.investing.com/news/economy/european-exchanges-defensive-appeal-attracts-investors-after-bank-turmoil-3055385,European exchanges' defensive appeal attracts investors after bank turmoil By Reuters,Investing.com
Yahoo,https://www.etfdailynews.com/2023/04/14/oppenheimer-raises-cme-group-nasdaqcme-price-target-to-221-00/,Oppenheimer Raises CME Group (NASDAQ:CME) Price Target to $221.00,ETF DAILY NEWS
Yahoo,https://www.reuters.com/markets/europe/european-exchanges-defensive-appeal-attracts-investors-after-bank-turmoil-2023-04-14/,European exchanges' defensive appeal attracts investors after bank turmoil,Reuters
Yahoo,https://www.fxstreet.com/news/gold-price-forecast-xau-usds-rally-has-further-to-run-in-the-quarters-ahead-ubs-202304121456,Gold Price Forecast: XAU/USD’s rally has further to run in the quarters ahead – UBS,The Forex Market
Yahoo,https://www.etfdailynews.com/2023/04/12/ubs-group-begins-coverage-on-capital-southwest-nasdaqcswc/,UBS Group Begins Coverage on Capital Southwest (NASDAQ:CSWC),ETF DAILY NEWS
Yahoo,https://www.etfdailynews.com/2023/04/14/wisdomtree-alternative-income-fund-batshyin-trading-up-0-6/,WisdomTree Alternative Income Fund (BATS:HYIN) Trading Up 0.6%,ETF DAILY NEWS
Yahoo,https://footwearnews.com/2023/business/retail/ubs-50000-stores-could-close-by-2027-1203444605/,"50,000 Stores Could Close in the Next 5 Years, UBS Says",Footwear News
Yahoo,https://www.etfdailynews.com/2023/04/14/morgan-stanley-lowers-icl-group-nyseicl-price-target-to-7-50/,Morgan Stanley Lowers ICL Group (NYSE:ICL) Price Target to $7.50,ETF DAILY NEWS
Yahoo,https://www.etfdailynews.com/2023/04/12/ubs-group-upgrades-asr-nederland-otcmktsasrrf-to-buy/,UBS Group Upgrades ASR Nederland (OTCMKTS:ASRRF) to Buy,ETF DAILY NEWS
Yahoo,https://www.etfdailynews.com/2023/04/14/morgan-stanley-lowers-icl-group-nyseicl-price-target-to-7-50/,Morgan Stanley Lowers ICL Group (NYSE:ICL) Price Target to $7.50,ETF DAILY NEWS
Yahoo,https://www.msn.com/en-in/money/news/tcs-ceo-designate-sees-impact-on-some-projects-due-to-credit-suisse-ubs-merger/ar-AA19NCeF?ocid=FinanceShimLayer,TCS CEO designate sees impact on some projects due to Credit Suisse-UBS merger,MSN News
Yahoo,https://www.chicagotribune.com/business/,Business News - Chicago Tribune,Chicago Tribune
Yahoo,https://www.etfdailynews.com/2023/04/08/ubs-group-lowers-myt-netherlands-parent-b-v-nysemyte-price-target-to-10-00/,UBS Group Lowers MYT Netherlands Parent B.V. (NYSE:MYTE) Price Target to $10.00,ETF DAILY NEWS
Yahoo,https://www.etfdailynews.com/2023/04/12/smurfit-kappa-group-otcmktssmfky-upgraded-to-buy-at-ubs-group/,Smurfit Kappa Group (OTCMKTS:SMFKY) Upgraded to “Buy” at UBS Group,ETF DAILY NEWS
Yahoo,https://www.msn.com/en-us/money/savingandinvesting/ubs-upgrades-evercore-partners-evr/ar-AA19Mx8X?ocid=FinanceShimLayer,UBS Upgrades Evercore Partners (EVR),MSN News
Yahoo,https://www.etfdailynews.com/2023/04/14/jefferies-financial-group-analysts-cut-earnings-estimates-for-the-goldman-sachs-group-inc-nysegs-2/,"Jefferies Financial Group Analysts Cut Earnings Estimates for The Goldman Sachs Group, Inc....",ETF DAILY NEWS
Yahoo,https://www.etfdailynews.com/2023/04/08/clorox-nyseclx-pt-raised-to-148-00-at-ubs-group/,Clorox (NYSE:CLX) PT Raised to $148.00 at UBS Group,ETF DAILY NEWS
Yahoo,https://www.etfdailynews.com/2023/04/12/spirax-sarco-engineering-otcmktsspxsf-downgraded-by-ubs-group-to-neutral/,Spirax-Sarco Engineering (OTCMKTS:SPXSF) Downgraded by UBS Group to Neutral,ETF DAILY NEWS
Yahoo,https://www.marketwatch.com/story/swiss-lawmakers-open-session-looking-at-ubs-credit-suisse-deal-63d064b9,Swiss lawmakers open session looking at UBS-Credit Suisse deal,Market Watch
Yahoo,https://www.etfdailynews.com/2023/04/14/q1-2023-earnings-estimate-for-regions-financial-co-issued-by-jefferies-financial-group-nyserf/,Q1 2023 Earnings Estimate for Regions Financial Co. Issued By Jefferies Financial Group (NYSE:RF),ETF DAILY NEWS
Yahoo,https://www.etfdailynews.com/2023/04/14/koninklijke-philips-nysephg-given-average-recommendation-of-hold-by-analysts/,Koninklijke Philips (NYSE:PHG) Given Average Recommendation of “Hold” by Analysts,ETF DAILY NEWS
Yahoo,https://www.etfdailynews.com/2023/04/12/western-union-nysewu-stock-rating-upgraded-by-ubs-group/,Western Union (NYSE:WU) Stock Rating Upgraded by UBS Group,ETF DAILY NEWS
Yahoo,https://www.barrons.com/articles/mid-cap-banks-profits-deposits-funding-crisis-5aae9532,"Mid-Cap Banks Face New Pressure on Profits, UBS Warns",Barron s Online
Yahoo,https://www.msn.com/en-us/money/savingandinvesting/ubs-maintains-kimberly-clark-kmb-neutral-recommendation/ar-AA19yQD4?ocid=FinanceShimLayer,UBS Maintains Kimberly-Clark (KMB) Neutral Recommendation,MSN News
Yahoo,https://www.msn.com/en-us/money/savingandinvesting/ubs-initiates-coverage-of-capital-southwest-cswc-with-neutral-recommendation/ar-AA19JSQD?ocid=FinanceShimLayer,UBS Initiates Coverage of Capital Southwest (CSWC) with Neutral Recommendation,MSN News
Yahoo,https://www.etfdailynews.com/2023/04/11/mt-bank-nysemtb-downgraded-to-neutral-at-ubs-group/,M&T Bank (NYSE:MTB) Downgraded to “Neutral” at UBS Group,ETF DAILY NEWS
Yahoo,https://www.msn.com/en-us/money/topstocks/ubs-maintains-pepsico-pep-buy-recommendation/ar-AA19yQMb?ocid=FinanceShimLayer,UBS Maintains PepsiCo (PEP) Buy Recommendation,MSN News
Yahoo,https://www.etfdailynews.com/2023/04/11/huntington-bancshares-nasdaqhban-downgraded-to-neutral-at-ubs-group/,Huntington Bancshares (NASDAQ:HBAN) Downgraded to “Neutral” at UBS Group,ETF DAILY NEWS
Yahoo,https://www.etfdailynews.com/2023/04/14/jefferies-financial-group-comments-on-jd-com-inc-s-fy2023-earnings-nasdaqjd/,"Jefferies Financial Group Comments on JD.com, Inc.’s FY2023 Earnings (NASDAQ:JD)",ETF DAILY NEWS
Yahoo,https://www.msn.com/en-us/money/topstocks/ubs-maintains-pepsico-pep-buy-recommendation/ar-AA19yQMb?ocid=FinanceShimLayer,UBS Maintains PepsiCo (PEP) Buy Recommendation,MSN News
Yahoo,https://www.etfdailynews.com/2023/04/11/huntington-bancshares-nasdaqhban-downgraded-to-neutral-at-ubs-group/,Huntington Bancshares (NASDAQ:HBAN) Downgraded to “Neutral” at UBS Group,ETF DAILY NEWS
Yahoo,https://www.etfdailynews.com/2023/04/14/jefferies-financial-group-comments-on-jd-com-inc-s-fy2023-earnings-nasdaqjd/,"Jefferies Financial Group Comments on JD.com, Inc.’s FY2023 Earnings (NASDAQ:JD)",ETF DAILY NEWS
Yahoo,https://www.etfdailynews.com/2023/04/14/comerica-incorporated-nysecma-to-post-q1-2023-earnings-of-2-30-per-share-jefferies-financial-group-forecasts/,"Comerica Incorporated (NYSE:CMA) to Post Q1 2023 Earnings of $2.30 Per Share, Jefferies Financial...",ETF DAILY NEWS
Yahoo,https://www.etfdailynews.com/2023/04/08/ubs-group-lowers-stem-nysestem-price-target-to-9-50/,UBS Group Lowers Stem (NYSE:STEM) Price Target to $9.50,ETF DAILY NEWS
Yahoo,https://seekingalpha.com/article/4594045-clearbridge-international-growth-adr-strategy-q1-2023-portfolio-manager-commentary,ClearBridge International Growth ADR Strategy Q1 2023 Portfolio Manager Commentary,Seeking Alpha
Yahoo,https://www.etfdailynews.com/2023/04/14/lsb-industries-nyselxu-sets-new-52-week-low-after-analyst-downgrade/,LSB Industries (NYSE:LXU) Sets New 52-Week Low After Analyst Downgrade,ETF DAILY NEWS
Yahoo,https://www.etfdailynews.com/2023/04/14/old-dominion-freight-line-nasdaqodfl-trading-down-2-6-on-analyst-downgrade/,Old Dominion Freight Line (NASDAQ:ODFL) Trading Down 2.6% on Analyst Downgrade,ETF DAILY NEWS
Yahoo,https://www.fxstreet.com/news/gold-price-forecast-xau-usd-to-hit-2-100-by-year-end-ubs-202304111450,"Gold Price Forecast: XAU/USD to hit $2,100 by year-end – UBS",The Forex Market
Yahoo,https://www.etfdailynews.com/2023/04/08/ubs-group-increases-oneok-nyseoke-price-target-to-82-00/,UBS Group Increases ONEOK (NYSE:OKE) Price Target to $82.00,ETF DAILY NEWS
Yahoo,https://www.marketwatch.com/story/swiss-lawmakers-open-session-looking-at-ubs-credit-suisse-deal-63d064b9,Swiss lawmakers open session looking at UBS-Credit Suisse deal,Market Watch
Yahoo,https://www.etfdailynews.com/2023/04/08/ubs-group-trims-energizer-nyseenr-target-price-to-40-00/,UBS Group Trims Energizer (NYSE:ENR) Target Price to $40.00,ETF DAILY NEWS
Yahoo,https://www.etfdailynews.com/2023/04/14/first-capital-nasdaqfcap-coverage-initiated-at-stocknews-com/,First Capital (NASDAQ:FCAP) Coverage Initiated at StockNews.com,ETF DAILY NEWS
Yahoo,https://www.etfdailynews.com/2023/04/14/q1-2023-earnings-estimate-for-regions-financial-co-issued-by-jefferies-financial-group-nyserf/,Q1 2023 Earnings Estimate for Regions Financial Co. Issued By Jefferies Financial Group (NYSE:RF),ETF DAILY NEWS
Yahoo,https://www.etfdailynews.com/2023/04/08/ubs-group-trims-molson-coors-beverage-nysetap-target-price-to-54-00/,UBS Group Trims Molson Coors Beverage (NYSE:TAP) Target Price to $54.00,ETF DAILY NEWS
Yahoo,https://www.benzinga.com/news/23/04/31725251/ubs-upgrades-western-union-to-neutral,UBS Upgrades Western Union to Neutral - Western Union (NYSE:WU),Benzinga
Yahoo,https://www.etfdailynews.com/2023/04/14/koninklijke-philips-nysephg-given-average-recommendation-of-hold-by-analysts/,Koninklijke Philips (NYSE:PHG) Given Average Recommendation of “Hold” by Analysts,ETF DAILY NEWS
Yahoo,https://www.etfdailynews.com/2023/04/12/western-union-nysewu-stock-rating-upgraded-by-ubs-group/,Western Union (NYSE:WU) Stock Rating Upgraded by UBS Group,ETF DAILY NEWS
Yahoo,https://www.barrons.com/articles/mid-cap-banks-profits-deposits-funding-crisis-5aae9532,"Mid-Cap Banks Face New Pressure on Profits, UBS Warns",Barron s Online
Yahoo,https://www.msn.com/en-us/money/savingandinvesting/ubs-maintains-kimberly-clark-kmb-neutral-recommendation/ar-AA19yQD4?ocid=FinanceShimLayer,UBS Maintains Kimberly-Clark (KMB) Neutral Recommendation,MSN News
Yahoo,https://www.barrons.com/articles/mid-cap-banks-profits-deposits-funding-crisis-5aae9532,"Mid-Cap Banks Face New Pressure on Profits, UBS Warns",Barron s Online
Yahoo,https://www.msn.com/en-us/money/savingandinvesting/ubs-maintains-kimberly-clark-kmb-neutral-recommendation/ar-AA19yQD4?ocid=FinanceShimLayer,UBS Maintains Kimberly-Clark (KMB) Neutral Recommendation,MSN News
Yahoo,https://www.msn.com/en-us/money/savingandinvesting/ubs-initiates-coverage-of-capital-southwest-cswc-with-neutral-recommendation/ar-AA19JSQD?ocid=FinanceShimLayer,UBS Initiates Coverage of Capital Southwest (CSWC) with Neutral Recommendation,MSN News
Yahoo,https://www.etfdailynews.com/2023/04/11/mt-bank-nysemtb-downgraded-to-neutral-at-ubs-group/,M&T Bank (NYSE:MTB) Downgraded to “Neutral” at UBS Group,ETF DAILY NEWS
Yahoo,https://www.msn.com/en-us/money/topstocks/ubs-maintains-pepsico-pep-buy-recommendation/ar-AA19yQMb?ocid=FinanceShimLayer,UBS Maintains PepsiCo (PEP) Buy Recommendation,MSN News
Yahoo,https://www.etfdailynews.com/2023/04/11/huntington-bancshares-nasdaqhban-downgraded-to-neutral-at-ubs-group/,Huntington Bancshares (NASDAQ:HBAN) Downgraded to “Neutral” at UBS Group,ETF DAILY NEWS
Yahoo,https://www.etfdailynews.com/2023/04/14/jefferies-financial-group-comments-on-jd-com-inc-s-fy2023-earnings-nasdaqjd/,"Jefferies Financial Group Comments on JD.com, Inc.’s FY2023 Earnings (NASDAQ:JD)",ETF DAILY NEWS
Yahoo,https://www.etfdailynews.com/2023/04/14/comerica-incorporated-nysecma-to-post-q1-2023-earnings-of-2-30-per-share-jefferies-financial-group-forecasts/,"Comerica Incorporated (NYSE:CMA) to Post Q1 2023 Earnings of $2.30 Per Share, Jefferies Financial...",ETF DAILY NEWS
Yahoo,https://www.etfdailynews.com/2023/04/08/ubs-group-lowers-stem-nysestem-price-target-to-9-50/,UBS Group Lowers Stem (NYSE:STEM) Price Target to $9.50,ETF DAILY NEWS
Yahoo,https://www.fxstreet.com/news/gold-price-forecast-xau-usd-to-hit-2-100-by-year-end-ubs-202304111450,"Gold Price Forecast: XAU/USD to hit $2,100 by year-end – UBS",The Forex Market
Yahoo,https://www.etfdailynews.com/2023/04/14/old-dominion-freight-line-nasdaqodfl-trading-down-2-6-on-analyst-downgrade/,Old Dominion Freight Line (NASDAQ:ODFL) Trading Down 2.6% on Analyst Downgrade,ETF DAILY NEWS
Yahoo,https://www.etfdailynews.com/2023/04/08/ubs-group-increases-oneok-nyseoke-price-target-to-82-00/,UBS Group Increases ONEOK (NYSE:OKE) Price Target to $82.00,ETF DAILY NEWS
Yahoo,https://www.investopedia.com/markets-jump-as-wholesale-inflation-falls-7480627?utm_campaign=quote-yahoo&utm_source=yahoo&utm_medium=referral&yptr=yahoo,Markets Jump as Wholesale Inflation Falls,Investopedia
Yahoo,https://www.benzinga.com/news/23/04/31762946/ubs-upgrades-goldman-sachs-gr-to-buy,UBS Upgrades Goldman Sachs Gr to Buy - Goldman Sachs Gr (NYSE:GS),Benzinga
Yahoo,https://www.etfdailynews.com/2023/04/08/reynolds-consumer-products-nasdaqreyn-price-target-raised-to-29-00-at-ubs-group/,Reynolds Consumer Products (NASDAQ:REYN) Price Target Raised to $29.00 at UBS Group,ETF DAILY NEWS
Yahoo,https://www.etfdailynews.com/2023/04/14/best-buy-co-inc-nysebby-receives-average-recommendation-of-hold-from-brokerages/,"Best Buy Co., Inc. (NYSE:BBY) Receives Average Recommendation of “Hold” from Brokerages",ETF DAILY NEWS
Yahoo,https://www.etfdailynews.com/2023/04/14/moelis-company-nysemc-given-average-rating-of-reduce-by-brokerages/,Moelis & Company (NYSE:MC) Given Average Rating of “Reduce” by Brokerages,ETF DAILY NEWS
Yahoo,https://www.etfdailynews.com/2023/04/14/fy2023-eps-estimates-for-associated-banc-corp-nyseasb-lowered-by-jefferies-financial-group/,FY2023 EPS Estimates for Associated Banc-Corp (NYSE:ASB) Lowered by Jefferies Financial Group,ETF DAILY NEWS
Yahoo,https://www.etfdailynews.com/2023/04/14/national-cinemedias-ncmi-outperform-rating-reaffirmed-at-wedbush/,National CineMedia’s (NCMI) Outperform Rating Reaffirmed at Wedbush,ETF DAILY NEWS
Yahoo,https://www.etfdailynews.com/2023/04/08/ubs-group-increases-alphabet-nasdaqgoogl-price-target-to-123-00/,UBS Group Increases Alphabet (NASDAQ:GOOGL) Price Target to $123.00,ETF DAILY NEWS
Yahoo,https://www.etfdailynews.com/2023/04/14/moelis-company-nysemc-given-average-rating-of-reduce-by-brokerages/,Moelis & Company (NYSE:MC) Given Average Rating of “Reduce” by Brokerages,ETF DAILY NEWS
Yahoo,https://www.streetinsider.com/Reuters/Swiss+finance+minister+sees+no+stumbling+blocks+to+UBS+takeover+of+Credit+Suisse/21483458.html,Swiss finance minister sees no 'stumbling blocks' to UBS takeover of Credit Suisse,StreetInsider
Yahoo,https://www.etfdailynews.com/2023/04/14/fy2023-eps-estimates-for-associated-banc-corp-nyseasb-lowered-by-jefferies-financial-group/,FY2023 EPS Estimates for Associated Banc-Corp (NYSE:ASB) Lowered by Jefferies Financial Group,ETF DAILY NEWS
Yahoo,https://www.etfdailynews.com/2023/04/11/regions-financial-nyserf-upgraded-by-ubs-group-to-buy/,Regions Financial (NYSE:RF) Upgraded by UBS Group to Buy,ETF DAILY NEWS
Yahoo,https://www.etfdailynews.com/2023/04/14/national-cinemedias-ncmi-outperform-rating-reaffirmed-at-wedbush/,National CineMedia’s (NCMI) Outperform Rating Reaffirmed at Wedbush,ETF DAILY NEWS
Yahoo,https://www.benzinga.com/content/seekingalpha-com/23/04/31771805/ubs-said-to-weigh-retaining-credit-suisses-wealth-unit-in-india,UBS said to weigh retaining Credit Suisse's wealth unit in India - UBS Gr (NYSE:UBS),Benzinga
Yahoo,https://www.etfdailynews.com/2023/04/14/td-cowen-cuts-intercure-nasdaqincr-price-target-to-5-00/,TD Cowen Cuts InterCure (NASDAQ:INCR) Price Target to $5.00,ETF DAILY NEWS
Yahoo,https://www.etfdailynews.com/2023/04/08/ubs-group-increases-alphabet-nasdaqgoogl-price-target-to-123-00/,UBS Group Increases Alphabet (NASDAQ:GOOGL) Price Target to $123.00,ETF DAILY NEWS
Yahoo,https://finance.yahoo.com/news/swiss-government-parliaments-rejection-state-145744739.html?fr=sycsrp_catchall,Swiss government: parliament's rejection of state aid for Credit Suisse rescue won't derail deal,Reuters via Yahoo Finance
Yahoo,https://www.etfdailynews.com/2023/04/14/foot-locker-inc-nysefl-given-average-rating-of-hold-by-brokerages/,"Foot Locker, Inc. (NYSE:FL) Given Average Rating of “Hold” by Brokerages",ETF DAILY NEWS
Yahoo,https://www.etfdailynews.com/2023/04/14/lifeway-foods-nasdaqlway-stock-price-crosses-above-two-hundred-day-moving-average-of-6-02/,Lifeway Foods (NASDAQ:LWAY) Stock Price Crosses Above Two Hundred Day Moving Average of $6.02,ETF DAILY NEWS
Yahoo,https://www.etfdailynews.com/2023/04/14/rio-tinto-group-lonrio-stock-price-passes-above-200-day-moving-average-of-5545-78/,"Rio Tinto Group (LON:RIO) Stock Price Passes Above 200-Day Moving Average of $5,545.78",ETF DAILY NEWS
Yahoo,https://www.etfdailynews.com/2023/04/14/landmark-bancorp-nasdaqlark-receives-new-coverage-from-analysts-at-stocknews-com/,Landmark Bancorp (NASDAQ:LARK) Receives New Coverage from Analysts at StockNews.com,ETF DAILY NEWS
Yahoo,https://www.etfdailynews.com/2023/04/11/buckle-nysebke-receives-new-coverage-from-analysts-at-ubs-group/,Buckle (NYSE:BKE) Receives New Coverage from Analysts at UBS Group,ETF DAILY NEWS
Yahoo,https://www.etfdailynews.com/2023/04/14/knot-offshore-partners-nyseknop-downgraded-by-stocknews-com/,KNOT Offshore Partners (NYSE:KNOP) Downgraded by StockNews.com,ETF DAILY NEWS
Yahoo,https://www.etfdailynews.com/2023/04/14/pdd-holdings-inc-nasdaqpdd-given-average-rating-of-buy-by-brokerages/,PDD Holdings Inc. (NASDAQ:PDD) Given Average Rating of “Buy” by Brokerages,ETF DAILY NEWS
Yahoo,https://www.etfdailynews.com/2023/04/14/capital-one-financial-analysts-increase-earnings-estimates-for-conocophillips-nysecop/,Capital One Financial Analysts Increase Earnings Estimates for ConocoPhillips (NYSE:COP),ETF DAILY NEWS
Yahoo,https://www.etfdailynews.com/2023/04/14/summit-financial-group-nasdaqsmmf-stock-price-crosses-below-200-day-moving-average-of-25-63/,Summit Financial Group (NASDAQ:SMMF) Stock Price Crosses Below 200-Day Moving Average of $25.63,ETF DAILY NEWS
Yahoo,https://www.etfdailynews.com/2023/04/08/ubs-group-increases-monster-beverage-nasdaqmnst-price-target-to-56-00/,UBS Group Increases Monster Beverage (NASDAQ:MNST) Price Target to $56.00,ETF DAILY NEWS
Yahoo,https://www.etfdailynews.com/2023/04/08/targa-resources-nysetrgp-price-target-raised-to-108-00-at-ubs-group/,Targa Resources (NYSE:TRGP) Price Target Raised to $108.00 at UBS Group,ETF DAILY NEWS
Yahoo,https://www.etfdailynews.com/2023/04/14/columbia-sportswear-nasdaqcolm-receives-average-recommendation-of-hold-from-analysts/,Columbia Sportswear (NASDAQ:COLM) Receives Average Recommendation of “Hold” from Analysts,ETF DAILY NEWS
Yahoo,https://www.etfdailynews.com/2023/04/14/oracle-co-nyseorcl-receives-average-rating-of-moderate-buy-from-analysts/,Oracle Co. (NYSE:ORCL) Receives Average Rating of “Moderate Buy” from Analysts,ETF DAILY NEWS
Yahoo,https://www.etfdailynews.com/2023/04/14/morgan-stanley-cuts-ameriprise-financial-nyseamp-price-target-to-338-00/,Morgan Stanley Cuts Ameriprise Financial (NYSE:AMP) Price Target to $338.00,ETF DAILY NEWS
Yahoo,https://www.etfdailynews.com/2023/04/14/daily-dow-jones-internet-bull-3x-shares-nysearcawebl-stock-price-up-7-3/,Daily Dow Jones Internet Bull 3X Shares (NYSEARCA:WEBL) Stock Price Up 7.3%,ETF DAILY NEWS
Yahoo,https://www.etfdailynews.com/2023/04/08/ubs-group-trims-estee-lauder-companies-nyseel-target-price-to-278-00/,UBS Group Trims Estée Lauder Companies (NYSE:EL) Target Price to $278.00,ETF DAILY NEWS
Yahoo,https://www.etfdailynews.com/2023/04/14/innoviz-technologies-nasdaqinvz-price-target-lowered-to-4-50-at-the-goldman-sachs-group/,Innoviz Technologies (NASDAQ:INVZ) Price Target Lowered to $4.50 at The Goldman Sachs Group,ETF DAILY NEWS
Yahoo,https://www.etfdailynews.com/2023/04/14/morgan-stanley-trims-moelis-company-nysemc-target-price-to-29-00/,Morgan Stanley Trims Moelis & Company (NYSE:MC) Target Price to $29.00,ETF DAILY NEWS
Yahoo,https://www.etfdailynews.com/2023/04/08/ubs-group-increases-church-dwight-nysechd-price-target-to-93-00/,UBS Group Increases Church & Dwight (NYSE:CHD) Price Target to $93.00,ETF DAILY NEWS
Yahoo,https://www.etfdailynews.com/2023/04/14/cardlytics-nasdaqcdlx-price-target-raised-to-6-00/,Cardlytics (NASDAQ:CDLX) Price Target Raised to $6.00,ETF DAILY NEWS
Yahoo,https://www.etfdailynews.com/2023/04/14/compass-pathways-nasdaqcmps-stock-rating-reaffirmed-by-ef-hutton-acquisition-co-i/,COMPASS Pathways (NASDAQ:CMPS) Stock Rating Reaffirmed by EF Hutton Acquisition Co. I,ETF DAILY NEWS
Yahoo,https://www.etfdailynews.com/2023/04/09/mazda-motor-otcmktsmzday-rating-lowered-to-neutral-at-ubs-group/,Mazda Motor (OTCMKTS:MZDAY) Rating Lowered to Neutral at UBS Group,ETF DAILY NEWS
Yahoo,https://www.etfdailynews.com/2023/04/14/q2-2023-eps-estimates-for-cognizant-technology-solutions-co-decreased-by-analyst-nasdaqctsh/,Q2 2023 EPS Estimates for Cognizant Technology Solutions Co. Decreased by Analyst (NASDAQ:CTSH),ETF DAILY NEWS
Yahoo,https://www.reuters.com/article/switzerland-parliament-credit-suisse-idUSS8N33K00Z,Credit Suisse had gigantic outflows in weekend merger with UBS was announced,Reuters
Yahoo,https://www.digitaljournal.com/business/stocks-rally-dollar-dips-further-on-easing-rate-expectations/article,"Stocks rally, dollar dips further on easing rate expectations",Digital Journal
Yahoo,https://www.etfdailynews.com/2023/04/14/investors-buy-high-volume-of-best-buy-put-options-nysebby/,Investors Buy High Volume of Best Buy Put Options (NYSE:BBY),ETF DAILY NEWS
Yahoo,https://www.etfdailynews.com/2023/04/14/jefferies-financial-group-equities-analysts-lower-earnings-estimates-for-jpmorgan-chase-co-nysejpm/,Jefferies Financial Group Equities Analysts Lower Earnings Estimates for JPMorgan Chase & Co....,ETF DAILY NEWS
Yahoo,https://www.etfdailynews.com/2023/04/14/first-trust-new-york-municipal-high-income-etf-nysearcafmny-trading-down-0-2/,First Trust New York Municipal High Income ETF (NYSEARCA:FMNY) Trading Down 0.2%,ETF DAILY NEWS
Yahoo,https://www.etfdailynews.com/2023/04/14/hyliion-nysehyln-pt-lowered-to-1-75/,Hyliion (NYSE:HYLN) PT Lowered to $1.75,ETF DAILY NEWS
Yahoo,https://www.etfdailynews.com/2023/04/14/jefferies-financial-group-comments-on-mt-bank-co-s-q1-2023-earnings-nysemtb/,Jefferies Financial Group Comments on M&T Bank Co.’s Q1 2023 Earnings (NYSE:MTB),ETF DAILY NEWS
Yahoo,https://www.etfdailynews.com/2023/04/14/q1-2023-earnings-estimate-for-moelis-company-nysemc-issued-by-seaport-res-ptn/,Q1 2023 Earnings Estimate for Moelis & Company (NYSE:MC) Issued By Seaport Res Ptn,ETF DAILY NEWS
Yahoo,https://www.etfdailynews.com/2023/04/14/hyliion-nysehyln-pt-lowered-to-1-75/,Hyliion (NYSE:HYLN) PT Lowered to $1.75,ETF DAILY NEWS
Yahoo,https://www.etfdailynews.com/2023/04/14/jefferies-financial-group-comments-on-mt-bank-co-s-q1-2023-earnings-nysemtb/,Jefferies Financial Group Comments on M&T Bank Co.’s Q1 2023 Earnings (NYSE:MTB),ETF DAILY NEWS
