Search Engine,Link,Title,Source
Bing,https://www.bloomberg.com/news/articles/2023-04-11/credit-suisse-deal-to-turn-ubs-into-wealth-management-powerhouse-jpmorgan-says,"Credit Suisse Takeover Will Turn UBS Into Wealth Management ‘Powerhouse,’ JPMorgan Says",Bloomberg L.P.
Bing,https://www.msn.com/en-us/money/other/swiss-parliament-s-lower-house-debates-ubs-deal-after-upper-house-nod-1/ar-AA19JtwH,Parliament’s Upper House Agrees to Guarantees for UBS-CS Merger,Bloomberg on MSN
Bing,https://www.reuters.com/world/india/ubs-considers-retaining-credit-suisses-india-unit-bloomberg-news-2023-04-12/,UBS considers retaining Credit Suisse's India unit - Bloomberg News,Reuters
Bing,https://www.bloomberg.com/news/articles/2023-04-12/ubs-weighs-retaining-credit-suisse-unit-serving-india-s-rich,UBS Weighs Retaining Credit Suisse Unit Serving India’s Rich,Bloomberg L.P.
Bing,https://www.msn.com/en-us/money/other/brace-for-stock-market-volatility-to-persist-this-year-as-investors-get-bombarded-with-economic-data-ubs-says/ar-AA19L2bC,"Brace for stock-market volatility to persist this year as investors get bombarded with economic data, UBS says",Business Insider on MSN
Bing,https://finance.yahoo.com/news/ubs-mulls-keeping-credit-suisse-154135669.html,UBS Mulls Keeping Credit Suisse Private Wealth Unit Targeting India's Wealthy Diaspora,YAHOO!Finance
Bing,https://seekingalpha.com/news/3956034-credit-suisse-ubs-deal-voted-down-by-swiss-parliaments-lower-house,"Credit Suisse, UBS deal voted down by Swiss parliament's lower house",Seeking Alpha
Bing,https://www.barrons.com/articles/alibaba-jd-baidu-chinese-stocks-23a08c41,Good News for Alibaba and Other Chinese Stocks. UBS Sees 3 Reasons to Be Bullish.,Barron's
Bing,https://money.yahoo.com/50-000-stores-could-close-193032161.html,"50,000 Stores Could Close in the Next 5 Years, UBS Says",Yahoo Money
Bing,https://www.msn.com/en-us/money/markets/“a-dramatic-tragedy”-swiss-parliament-split-on-ubs-takeover-of-credit-suisse/ar-AA19IXNg,“A dramatic tragedy”: Swiss parliament split on UBS takeover of Credit Suisse,MSN
Bing,https://www.bizjournals.com/washington/news/2023/04/12/ubs-skanska-dc-office.html,UBS to relocate D.C. offices to Skanska's newest trophy property,The Business Journals
Bing,https://www.bloomberg.com/news/articles/2023-04-13/ubs-hires-strategy-consultants-oliver-wyman-to-help-with-credit-suisse-deal,UBS Hires Strategy Consultants Oliver Wyman to Help With Credit Suisse Integration,Bloomberg L.P.
Bing,https://www.msn.com/en-us/money/companies/ubs-taps-jpmorgan-to-explore-possible-ipo-of-credit-suisse-s-domestic-business-report/ar-AA19Og4j,UBS taps JPMorgan to explore possible IPO of Credit Suisse’s domestic business: report,MarketWatch on MSN
Bing,https://markets.businessinsider.com/news/stocks/ubs-remains-a-buy-on-nufarm-limited-nufmf-1032231447,UBS Remains a Buy on Nufarm Limited (NUFMF),Business Insider
Bing,https://markets.businessinsider.com/news/stocks/ubs-sticks-to-their-buy-rating-for-beach-energy-limited-beptf-1032231453,UBS Sticks to Their Buy Rating for Beach Energy Limited (BEPTF),Business Insider
Bing,https://www.cnbc.com/2023/04/10/sell-mining-stocks-and-load-up-on-energy-ones-with-these-8-names-ubs.html,Sell these mining stocks and load up on 8 energy ones instead: UBS,CNBC
Bing,https://www.msn.com/en-us/money/markets/swiss-finance-minister-sees-no-stumbling-blocks-to-ubs-takeover-of-credit-suisse/ar-AA19CBDz,Swiss finance minister sees no 'stumbling blocks' to UBS takeover of Credit Suisse,Reuters on MSN
Bing,https://www.msn.com/en-us/money/markets/the-buckle-started-at-neutral-as-ubs-sees-macro-headwinds-balancing-sales-growth/ar-AA19GwnX,The Buckle started at Neutral as UBS sees macro headwinds balancing sales growth,Seeking Alpha on MSN
Bing,https://markets.businessinsider.com/news/stocks/corporate-travel-management-limited-ctmlf-gets-a-buy-from-ubs-1032231452,Corporate Travel Management Limited (CTMLF) Gets a Buy from UBS,Business Insider
Bing,https://www.insurancebusinessmag.com/us/news/breaking-news/ubs-chief-gets-reelected-as-swiss-re-chair-ahead-of-departure-from-reinsurer-442593.aspx,UBS chief gets re-elected as Swiss Re chair ahead of departure from reinsurer,insurancebusinessmag
Bing,https://www.investmentnews.com/credit-suisse-deal-will-make-ubs-a-wealth-management-powerhouse-jpmorgan-236257,Credit Suisse deal will make UBS a wealth management ‘powerhouse’: JPMorgan,InvestmentNews
Bing,https://markets.businessinsider.com/news/stocks/ubs-sticks-to-their-buy-rating-for-deutsche-bank-ag-db-1032231146,UBS Sticks to Their Buy Rating for Deutsche Bank AG (DB),Business Insider
Bing,https://markets.businessinsider.com/news/stocks/ubs-keeps-their-buy-rating-on-lanxess-lnxsf-1032230143,UBS Keeps Their Buy Rating on LANXESS (LNXSF),Business Insider
Bing,https://www.sportsbusinessdaily.com/Daily/Issues/2023/04/10/Facilities/ubs-arena-islanders-naming-rights-mercedes-f1-team-sponsorship.aspx,"UBS says Isles deal ‘has delivered,’ F1 ‘important’ for brand",Sports Business Journal
Bing,https://www.msn.com/en-us/money/markets/ubs-gr-unusual-options-activity/ar-AA19MTqC,UBS Gr Unusual Options Activity,Benzinga on MSN
Bing,https://www.msn.com/en-us/money/companies/mcdonalds-same-store-growth-will-accelerate-past-internal-estimates-ubs-geiger/vi-AA19GzTG,McDonald's same-store growth will accelerate past internal estimates: UBS' Geiger,CNBC on MSN
Bing,https://finance.yahoo.com/video/chinas-recovery-track-says-ubss-031335687.html,"China's Recovery Is Right on Track, Says UBS's Hu",YAHOO!Finance
Bing,https://www.msn.com/de-de/finanzen/top-stories/ubs-holt-oliver-wyman-als-hilfe-bei-credit-suisse-integration/ar-AA19OjKD,UBS holt Oliver Wyman als Hilfe bei Credit-Suisse-Integration,Bloomberg L.P. on MSN
Bing,https://markets.businessinsider.com/news/stocks/mercedes-benz-group-mbgaf-receives-a-buy-from-ubs-1032230029,Mercedes-Benz Group (MBGAF) Receives a Buy from UBS,Business Insider
Bing,https://commercialobserver.com/2023/04/ubs-inks-lease-at-skanskas-upcoming-17xm-tower-in-dc/,UBS Inks Lease at Skanska’s Upcoming 17xM Tower in DC,Commercial Observer
Bing,https://www.retaildive.com/news/50k-stores-may-close-2027-ubs/647392/,More than 50K stores may close by 2027: UBS,Retail Dive
Bing,https://www.msn.com/en-us/money/savingandinvesting/ubs-upgrades-evercore-partners-evr/ar-AA19Mx8X,UBS Upgrades Evercore Partners (EVR),MSN
Bing,https://www.bloomberg.com/news/articles/2023-04-11/swiss-government-set-for-grilling-over-ubs-credit-suisse-deal,Swiss Government Set for Grilling Over UBS-Credit Suisse Deal,Bloomberg L.P.
Bing,https://www.washingtonpost.com/business/2023/04/05/how-ubs-can-turn-a-wake-for-credit-suisse-into-a-party/4f2501b6-d3ac-11ed-ac8b-cd7da05168e9_story.html,How UBS Can Turn a Wake for Credit Suisse Into a Party,The Washington Post
Bing,https://www.msn.com/en-in/money/topstories/ubs-considers-retaining-credit-suisse-s-private-banking-unit-in-india-report/ar-AA19Kh1B,UBS considers retaining Credit Suisse's private banking unit in India: Report,Business Today on MSN
Bing,https://www.bloomberg.com/news/articles/2023-04-12/swiss-lower-house-scuppers-bill-to-approve-ubs-guarantees,Swiss Lower House Scuppers Bill to Approve UBS Guarantees,Bloomberg L.P.
Bing,https://www.msn.com/en-us/money/topstocks/ubs-downgrades-huntington-bancshares-hban/ar-AA19GZGy,UBS Downgrades Huntington Bancshares (HBAN),Fintel on MSN
Bing,https://news.yahoo.com/swiss-parliament-grapples-compromise-ubs-072753540.html,Swiss Parliament Grapples With Compromise on UBS Guarantees,YAHOO!News
Bing,https://www.bloomberg.com/graphics/2023-layoff-tracker-credit-suisse-ubs-job-cuts/,UBS Joins a Rising Tide of Global Layoffs Beyond Big Tech,Bloomberg L.P.
Bing,https://www.msn.com/en-us/money/personalfinance/credit-suisse-had-gigantic-outflows-in-weekend-merger-with-ubs-was-announced/ar-AA19KT0J,Credit Suisse had gigantic outflows in weekend merger with UBS was announced,Reuters on MSN
Bing,https://news.yahoo.com/swiss-lower-house-votes-second-122149689.html,Swiss Lower House Censures UBS Guarantees in Symbolic Vote,YAHOO!News
Bing,https://www.globalcapital.com/article/2biwfsa6oyfnbu0w2t4w0/equity/equity-people-and-markets/mercier-departs-ubs-after-13-years,Mercier departs UBS after 13 years,GlobalCapital
Bing,https://www.msn.com/en-ae/news/others/oil-production-cuts-to-tighten-market-from-may-and-boost-prices-ubs-says/ar-AA19KbLs,"Oil production cuts to tighten market from May and boost prices, UBS says",The National on MSN
Bing,https://www.msn.com/en-us/money/savingandinvesting/ubs-initiates-coverage-of-capital-southwest-cswc-with-neutral-recommendation/ar-AA19JSQD,UBS Initiates Coverage of Capital Southwest (CSWC) with Neutral Recommendation,Fintel on MSN
Bing,https://abcnews.go.com/International/wireStory/swiss-regulators-defend-rescue-credit-suisse-ubs-deal-98372287,UBS confident about Credit Suisse deal despite 'huge' risk,ABC
Bing,https://www.msn.com/en-us/money/savingandinvesting/ubs-upgrades-goldman-sachs-group-gs/ar-AA19N8zg,UBS Upgrades Goldman Sachs Group (GS),Fintel on MSN
Bing,https://www.barrons.com/articles/mid-cap-banks-profits-deposits-funding-crisis-5aae9532,"Mid-Cap Banks Face New Pressure on Profits After ‘Crisis,’ UBS Warns",Barron's
Bing,https://www.msn.com/en-us/money/topstocks/ubs-upgrades-regions-financial-rf/ar-AA19GXaA,UBS Upgrades Regions Financial (RF),Fintel on MSN
Bing,https://markets.businessinsider.com/news/stocks/analysts-offer-insights-on-financial-companies-ubs-group-ag-ubs-and-corebridge-financial-inc-crbg-1032222754,"Analysts Offer Insights on Financial Companies: UBS Group AG (UBS) and Corebridge Financial, Inc. (CRBG)",Business Insider
Bing,https://www.insurancebusinessmag.com/au/news/breaking-news/ubs-boss-gets-reelected-as-swiss-re-chairman-ahead-of-departure-from-reinsurer-442597.aspx,UBS boss gets re-elected as Swiss Re chairman ahead of departure from reinsurer,insurancebusinessmag
Bing,https://www.cnbc.com/2023/04/10/ubs-says-gains-will-be-limited-for-this-banking-stock-after-recent-crisis.html,"UBS downgrades this regional bank, says 'structural uncertainties' will pressure the stock",CNBC
Bing,https://www.msn.com/en-ae/news/others/oil-production-cuts-to-tighten-market-from-may-and-boost-prices-ubs-says/ar-AA19KbLs,"Oil production cuts to tighten market from May and boost prices, UBS says",The National on MSN
Bing,https://www.reuters.com/business/finance/ubs-chairman-addresses-shareholders-milestone-credit-suisse-takeover-2023-04-05/,UBS Chairman addresses shareholders on milestone Credit Suisse takeover,Reuters
Bing,https://www.msn.com/en-us/money/markets/ubs-faces-investors-after-shotgun-credit-suisse-takeover/ar-AA19uw3O,UBS faces investors after shotgun Credit Suisse takeover,Reuters on MSN
Bing,https://www.msn.com/en-us/money/topstocks/ubs-maintains-united-therapeutics-uthr-buy-recommendation/ar-AA19H1Be,UBS Maintains United Therapeutics (UTHR) Buy Recommendation,Fintel on MSN
Bing,https://www.msn.com/en-us/money/savingandinvesting/ubs-maintains-constellation-brands-stz-buy-recommendation/ar-AA19HnQM,UBS Maintains Constellation Brands (STZ) Buy Recommendation,Fintel on MSN
Bing,https://www.msn.com/en-us/money/companies/ubs-upgrades-western-union-wu/ar-AA19Hq6T,UBS Upgrades Western Union (WU),Fintel on MSN
Bing,https://www.msn.com/en-us/money/topstocks/ubs-downgrades-m-t-bank-mtb/ar-AA19HgO2,UBS Downgrades M & T Bank (MTB),Fintel on MSN
Bing,https://markets.businessinsider.com/news/stocks/ubs-reaffirms-their-hold-rating-on-challenger-limited-cfigf-1032222772,UBS Reaffirms Their Hold Rating on Challenger Limited (CFIGF),Business Insider
Bing,https://www.upi.com/Top_News/World-News/2023/04/05/Switzerland-Regulators-Justify-Credit-Suisse-UBS-Merger/1641680689146/,Swiss regulators say UBS takeover of Credit Suisse was 'best option available',UPI
Bing,https://www.msn.com/en-us/money/markets/swiss-finance-minister-says-there-are-no-obstacles-for-ubs-and-credit-suisse/ar-AA19Dexi,Swiss finance minister says there are no obstacles for UBS and Credit Suisse,Cryptopolitan on MSN
Bing,https://www.msn.com/en-us/money/companies/ubs-tells-investors-shotgun-credit-suisse-takeover-a-major-challenge/ar-AA19uQvi,UBS tells investors shotgun Credit Suisse takeover a 'major challenge',Reuters on MSN
Bing,https://www.reuters.com/markets/europe/bank-england-approves-ubss-credit-suisse-takeover-uk-sources-2023-04-04/,Exclusive: Bank of England approves UBS's Credit Suisse takeover in UK -sources,Reuters
Bing,https://www.forbes.com/sites/greatspeculations/2023/04/04/ubs-stock-is-trading-below-its-fair-value/,UBS Stock Is Trading Below Its Fair Value,Forbes
Bing,https://markets.businessinsider.com/news/stocks/j-p-morgan-reaffirms-their-buy-rating-on-ubs-group-ag-ubs-1032223482,J.P. Morgan Reaffirms Their Buy Rating on UBS Group AG (UBS),Business Insider
Bing,https://www.msn.com/en-in/money/topstories/swiss-finance-minister-confident-of-smooth-ubs-takeover-of-credit-suisse/ar-AA19E2KA,Swiss Finance Minister confident of smooth UBS takeover of Credit Suisse,Business Today on MSN
Bing,https://www.marketwatch.com/story/swiss-lawmakers-open-session-looking-at-ubs-credit-suisse-deal-63d064b9,Swiss lawmakers open session looking at UBS-Credit Suisse deal,MarketWatch
Bing,https://markets.businessinsider.com/news/stocks/ubs-reaffirms-their-hold-rating-on-asx-limited-asxff-1032222771,UBS Reaffirms Their Hold Rating on ASX Limited (ASXFF),Business Insider
Bing,https://www.nasdaq.com/articles/guru-fundamental-report-for-ubs,Guru Fundamental Report for UBS,Nasdaq
Bing,https://www.nytimes.com/2023/04/05/business/dealbook/ubs-investors-credit-suisse.html,UBS Chiefs See Risks Ahead in Credit Suisse Takeover,The New York Times
Bing,https://www.reuters.com/business/finance/ubs-faces-investors-after-shotgun-credit-suisse-merger-2023-04-05/,UBS tells investors 'Herculean' Credit Suisse takeover will pay off,Reuters
Bing,https://www.msn.com/en-us/money/companies/corrected-rpt-update-2-ubs-tells-investors-shotgun-credit-suisse-takeover-a-major-challenge/ar-AA19uFcd,CORRECTED-RPT-UPDATE 2-UBS tells investors shotgun Credit Suisse takeover a 'major challenge',Reuters on MSN
Bing,https://www.barrons.com/articles/mid-cap-banks-profits-deposits-funding-crisis-5aae9532,"Mid-Cap Banks Face New Pressure on Profits After ‘Crisis,’ UBS Warns",Barron's
Bing,https://www.politico.eu/article/ubs-buys-credit-suisse-in-rush-deal/,UBS buys Credit Suisse in rush deal,Politico Europe
Bing,https://www.msn.com/en-in/money/news/tcs-ceo-designate-sees-impact-on-some-projects-due-to-credit-suisse-ubs-merger/ar-AA19NCeF,TCS CEO designate sees impact on some projects due to Credit Suisse-UBS merger,CNBCTV18 on MSN
Bing,https://www.msn.com/en-us/money/markets/bank-of-england-clears-ubs-325b-takeover-of-credit-suisse-in-uk-report/ar-AA19uLmZ,Bank of England clears UBS' $3.25B takeover of Credit Suisse in UK - report,Seeking Alpha on MSN
Bing,https://www.msn.com/en-ca/money/topstories/ubs-seeks-to-assure-investors-shotgun-credit-suisse-takeover-can-pay-off/ar-AA19uUDC,UBS seeks to assure investors shotgun Credit Suisse takeover can pay off,Reuters on MSN
Bing,https://www.cnbc.com/2023/04/05/ubs-says-this-little-known-food-packaging-stock-can-rally-nearly-30percent.html,UBS says this little-known food packaging stock can rally nearly 30%,CNBC
Bing,https://www.cnbc.com/2023/04/06/ubs-names-global-high-quality-dividend-stocks-with-over-5percent-yield.html,UBS names 6 global 'high-quality' dividend stocks with over 5% yield,CNBC
Bing,https://www.cnbc.com/2023/04/05/ubs-holds-first-shareholder-meeting-since-controversial-credit-suisse-takeover.html,'Historic day': UBS sets out plans in first shareholder meeting since Credit Suisse takeover,CNBC
Bing,https://www.reuters.com/business/finance/ubs-ceo-tells-credit-suisse-staff-stay-focused-clients-business-2023-04-06/,UBS CEO tells Credit Suisse staff to stay focused on clients and the business,Reuters
Bing,https://www.msn.com/en-us/money/companies/corrected-update-2-ubs-tells-investors-shotgun-credit-suisse-takeover-a-major-challenge/ar-AA19v3tN,CORRECTED-UPDATE 2-UBS tells investors shotgun Credit Suisse takeover a 'major challenge',Reuters on MSN
Bing,https://www.complianceweek.com/risk-management/ubs-prepping-for-herculean-task-of-integrating-credit-suisse/32927.article,UBS prepping for ‘Herculean task’ of integrating Credit Suisse,Compliance Week
Bing,https://www.msn.com/en-us/money/companies/ubs-faces-investors-after-shotgun-credit-suisse-merger/ar-AA19vQ9W,UBS faces investors after shotgun Credit Suisse merger,Reuters on MSN
Bing,https://www.msn.com/en-gb/money/other/ubs-and-credit-suisse-shares-drop-as-swiss-prosecutor-investigates-takeover/ar-AA19qu4S,UBS and Credit Suisse shares drop as Swiss prosecutor investigates takeover,Reuters on MSN
Bing,https://www.businessinsider.com/best-stock-picks-investing-high-upside-dividend-growth-profit-ubs-2023-4,UBS: Buy these 30 stocks to profit from their market-beating combination of upside and outsize dividend growth,Business Insider
Bing,https://seekingalpha.com/news/3954726-automakers-likely-driving-toward-overproduction-ubs,Automakers likely driving toward overproduction - UBS,Seeking Alpha
Bing,https://www.msn.com/en-au/money/companies/ubs-gets-temporary-eu-green-light-for-credit-suisse-deal-pending-review/ar-AA19t8QH,"UBS gets temporary EU green light for Credit Suisse deal, pending review",Reuters on MSN
Bing,https://www.bloomberg.com/opinion/articles/2023-04-05/how-ubs-can-turn-a-wake-for-credit-suisse-into-a-party,How UBS Can Turn a Wake for Credit Suisse Into a Party,Bloomberg L.P.
Bing,https://www.cnbc.com/2023/04/04/credit-suisse-agm-shareholders-demand-answers-over-ubs-rescue-deal.html,'I am truly sorry': Credit Suisse chair pleads with angry shareholders at annual meeting,CNBC
Bing,https://seekingalpha.com/news/3954780-ubs-chair-tells-investors-credit-suisse-deal-is-financially-attractive,UBS chair tells investors Credit Suisse deal is 'financially attractive',Seeking Alpha
Bing,https://www.bloomberg.com/news/articles/2023-04-05/credit-suisse-integration-will-take-up-to-4-years-ubs-update,Shareholders Fret Over Megabank Risk Profile: UBS Update,Bloomberg L.P.
Bing,https://www.nasdaq.com/articles/ubs-stock-is-trading-below-its-fair-value,UBS Stock Is Trading Below Its Fair Value,Nasdaq
Bing,https://www.fstech.co.uk/fst/Swiss_Parliament_Emergency_Meeting.php,Swiss parliament to hold emergency meeting over Credit Suisse-UBS merger,fstech
Bing,https://www.ibtimes.com/ubs-shareholders-weigh-credit-suisse-mega-merger-3683400,UBS Shareholders To Weigh In On Credit Suisse Mega-merger,International Business Times
Bing,https://www.marketwatch.com/press-release/seventeen-ubs-advisor-teams-in-southern-california-and-hawaii-named-to-the-forbes-best-in-state-wealth-management-teams-list-2023-04-06,Seventeen UBS Advisor Teams in Southern California and Hawaii Named to the Forbes Best-in-State Wealth Management Teams List,MarketWatch
Bing,https://www.nytimes.com/2023/04/04/business/dealbook/credit-suisse-shareholders.html,"For Credit Suisse Shareholders, a Wake Followed by Recriminations",The New York Times
Bing,https://marketingsentinel.com/2023/04/12/ubs-group-ag-nyse-ubs-shares-might-go-up-17-25-this-year/,UBS Group AG (NYSE: UBS) Shares Might Go Up 17.25% This Year,marketingsentinel
Bing,https://www.marketwatch.com/press-release/seventeen-ubs-advisor-teams-in-southern-california-and-hawaii-named-to-the-forbes-best-in-state-wealth-management-teams-list-2023-04-06,Seventeen UBS Advisor Teams in Southern California and Hawaii Named to the Forbes Best-in-State Wealth Management Teams List,MarketWatch
Bing,https://www.ubs.com/ch/en/private/pension/pillar-3/vitainvest.html,UBS Vitainvest investment funds,UBS
Bing,https://www.msn.com/en-xl/money/other/ubs-holds-first-shareholder-meeting-since-controversial-credit-suisse-takeover/ar-AA19uoBi,UBS holds first shareholder meeting since controversial Credit Suisse takeover,CNBC on MSN
Bing,https://lenews.ch/2023/04/07/ubs-had-a-secret-plan-to-takeover-credit-suisse/,UBS had secret plan to takeover Credit Suisse,Le News
Bing,https://www.msn.com/en-ph/news/other/credit-suisse-merger-right-choice-ubs/ar-AA19yeot,Credit Suisse merger right choice – UBS,The Manila Times on MSN
Bing,https://www.finews.com/news/english-news/56752-result-extraordiary-session-national-council,Outrage Over UBS Deal Finds a Majority in the Swiss National Council,finews
Bing,https://portfolio-adviser.com/rsmr-appoints-ex-ubs-and-tilney-director-to-research-team/,RSMR appoints ex-UBS and Tilney director to research team,portfolio-adviser.com
Bing,https://markets.buffalonews.com/buffnews/article/bizwire-2023-4-10-ubs-advisors-drew-freides-and-michael-kanigher-named-to-the-barrons-top-1200-advisors-list,UBS advisors Drew Freides and Michael Kanigher named to the Barron’s Top 1200 Advisors list,The Buffalo News
Bing,https://www.finews.com/news/english-news/56766-zug-based-finance-boutique-valterna-new-ceo-from-ubs-rene-brunner,Zug-Based Finance Boutique Brings in New CEO From UBS,finews
Bing,https://nypost.com/2023/03/21/ubs-credit-suisse-takeover-could-layoff-tens-of-thousands/,Credit Suisse rescue reportedly could spur ‘tens of thousands’ of layoffs,New York Post
Bing,https://www.usatoday.com/story/money/business/2023/03/19/ubs-announces-takeover-credit-suisse/11504931002/,Swiss banking giant UBS to buy troubled rival Credit Suisse to avoid a larger global financial crisis,USA Today
Bing,https://www.cnn.com/2023/03/19/business/credit-suisse-ubs-rescue/index.html,UBS is buying Credit Suisse in bid to halt banking crisis,CNN
Bing,https://finance.yahoo.com/quote/UBS/chart/,UBS Group AG (UBS),Yahoo Finance
Bing,https://abcnews.go.com/Business/wireStory/ubs-brings-back-ermotti-ceo-credit-suisse-deal-98198740,UBS brings back Ermotti as CEO with Credit Suisse deal ahead,ABC News
Bing,https://www.ubs.com/ch/en/private/pension/pillar-3/vitainvest.html,UBS Vitainvest investment funds,UBS
Bing,https://lenews.ch/2023/04/07/ubs-had-a-secret-plan-to-takeover-credit-suisse/,UBS had secret plan to takeover Credit Suisse,Le News
Bing,https://www.finews.com/news/english-news/56752-result-extraordiary-session-national-council,Outrage Over UBS Deal Finds a Majority in the Swiss National Council,finews
Bing,https://www.finews.com/news/english-news/56755-iqbal-khan-says-ubs-to-retain-credit-suisse-s-india-wealth-unit,Khan Says UBS May Retain Credit Suisse's India Wealth Unit,finews
Bing,https://www.finews.com/news/english-news/56766-zug-based-finance-boutique-valterna-new-ceo-from-ubs-rene-brunner,Zug-Based Finance Boutique Brings in New CEO From UBS,finews
Bing,https://nypost.com/2023/03/29/ubs-brings-back-ex-ceo-sergio-ermotti-after-credit-suisse-deal/,UBS brings back ex-CEO Sergio Ermotti after Credit Suisse deal,New York Post
Bing,https://www.nytimes.com/2023/03/29/business/dealbook/ubs-ceo-ermotti.html,UBS Brings Back Ex-C.E.O. to Manage Takeover of Troubled Credit Suisse,The New York Times
Bing,https://www.reuters.com/markets/ubs-buys-back-nearly-3-bln-bonds-issued-under-week-ago-2023-03-22/,UBS buys back bonds days after issue to buoy investor confidence,Reuters
Bing,https://www.reuters.com/breakingviews/ubs-salvages-most-value-credit-suisse-wreck-2023-03-19/,UBS salvages most value from Credit Suisse wreck,Reuters
Bing,https://www.fool.com/investing/2023/03/22/ubs-acquisition-credit-suisse-pay-off-shareholders/,Will UBS' Acquisition of Credit Suisse Pay Off for Shareholders?,The Motley Fool
Bing,https://seekingalpha.com/article/4588731-ubs-just-got-monster-bargain-investors-can-too,"UBS Just Got A Monster Bargain - And Investors Can, Too",Seeking Alpha
Bing,https://www.cnbc.com/2023/03/29/ubs-sergio-ermotti-switzerland-gets-a-cost-cutting-local-to-restore-its-reputation.html,"'Call of duty': With Sergio Ermotti, Switzerland gets a cost-cutting local to restore its reputation",CNBC
Bing,https://www.thestreet.com/banking/ubs-acquires-credit-suisse-for-more-than-3-billion,UBS Acquires Credit Suisse for More Than $3 Billion,TheStreet.com
Bing,https://www.ubs.com/us/en/wealth-management/about-us/disclosure-documents.html,Disclosure Documents,UBS
Bing,https://abcnews.go.com/International/wireStory/ubs-brings-back-ermotti-ceo-credit-suisse-deal-98198739,UBS brings back Ermotti as CEO with Credit Suisse deal ahead,ABC News
Bing,https://nypost.com/2023/03/20/credit-suisse-bondholders-blast-insane-ubs-takeover/,Credit Suisse bondholders blast ‘insane’ UBS takeover: ‘Against the law’,New York Post
Bing,https://www.boston.com/news/business/2023/03/19/ubs-to-buy-credit-suisse-for-nearly-3-25-billion-to-calm-turmoil/,UBS to buy Credit Suisse for nearly $3.25 billion to calm turmoil,Boston.com
Bing,https://www.reuters.com/breakingviews/boomerang-ubs-boss-ticks-several-important-boxes-2023-03-29/,Boomerang UBS boss ticks several important boxes,Reuters
Bing,https://www.foxbusiness.com/economy/ubs-reaches-agreement-to-buy-credit-suisse-after-upping-offer,UBS reaches agreement to buy Credit Suisse after upping offer,Fox Business
Bing,https://www.washingtonpost.com/business/2023/03/18/ubs-creditsuisse-takeover/,UBS said to be nearing deal in takeover talks with Credit Suisse,The Washington Post
Bing,https://www.cnbc.com/2023/03/29/stock-markets-ubs-gets-a-new-old-group-ceo.html,CNBC Daily Open: UBS gets a new (old) Group CEO,CNBC
Bing,https://www.bloomberg.com/opinion/articles/2023-03-20/ubs-got-credit-suisse-for-almost-nothing,UBS Got Credit Suisse for Almost Nothing,Bloomberg L.P.
Bing,https://www.nytimes.com/2023/03/19/business/ubs-credit-suisse.html,UBS Agrees to Buy Rival Credit Suisse,The New York Times
Bing,https://www.cnbc.com/2023/03/29/european-markets-live-updates-stocks-news-data-and-earnings.html,Europe markets close higher; UBS up 4% after bank announces Ermotti to return as CEO,CNBC
